"claim","review_url","claimer","text","headline","keywords","claim_date"
"http://data.gesis.org/claimskg/creative_work/51596b90-3054-5428-8f44-4050aef44070","http://www.politifact.com/wisconsin/statements/2011/oct/13/scott-walker/walkers-praise-teachers-not-all-encompassing/","Scott Walker","Says he never called teachers 'thugs' and has said nothing but 'great things' about them during the fight over his curbs on unions","Walker’s praise for teachers not all-encompassing","Labor,State Budget",2011-09-26
"http://data.gesis.org/claimskg/creative_work/3e1e5640-c2eb-5dc6-a2e4-02a3835365af","http://www.politifact.com/texas/statements/2018/feb/05/trey-blocker/challenger-says-sid-miller-was-slow-reveal-compute/","Trey Blocker","Says the Texas Department of Agriculture didn’t notify over 700 Texas students about a computer hack releasing critical personal information including Social Security numbers until 32 days after the breach.","Was Sid Miller slow to reveal a laptop hack that released students' personal data?","Agriculture,Food,Privacy",2018-01-24
"http://data.gesis.org/claimskg/creative_work/6d3ca806-9331-5547-9ddc-d59dfaa3fcc8","http://www.politifact.com/florida/statements/2015/feb/24/blog-posting/high-schoolers-had-recite-islamic-prayer-class-mak/","Bloggers","'Students In Fla. High School Forced To Recite Islamic Prayer, Make Prayer Rugs.'","High schoolers had to recite Islamic prayer in class, make prayer rugs as homework, websites say","Islam",2015-02-12
"http://data.gesis.org/claimskg/creative_work/b40bcb3f-e52f-5378-b5c3-0a9488547aae","http://www.politifact.com/missouri/statements/2017/mar/28/eric-greitens/greitens-hasnt-increased-education-budget-4-percen/","Eric Greitens","'K-12 education is getting more money this year than they did last year. ... It is a total increase of 4.1 percent.'","Greitens hasn't increased the education budget by 4 percent","State Budget",2017-02-02
"http://data.gesis.org/claimskg/creative_work/6c4c9e68-e084-5994-bbb1-847fd3c5f553","http://www.politifact.com/new-jersey/statements/2013/nov/10/chris-christie/chris-christie-tells-teacher-school-funding-highes/","Chris Christie","'In fact, there’s more state funding for education today than any other time.'","Chris Christie tells teacher school funding is highest it's ever been","State Budget",2013-11-02
"http://data.gesis.org/claimskg/creative_work/d55a3a76-104b-5b18-8560-3bd4adfd5158","http://www.politifact.com/florida/statements/2014/mar/24/florida-stop-common-core-coalition/florida-stop-common-core-coalition-says-education-/","Florida Stop Common Core Coalition","For educational testing, Florida 'has chosen a company that has a significant history of promoting identification of the GLBT lifestyle for children as young as seven years old.'","Florida Stop Common Core Coalition says education testing company promotes gay lifestyle to school children","Gays and Lesbians",2014-03-19
"http://data.gesis.org/claimskg/creative_work/cb28d9df-a0e8-5299-8112-0fd0d4acf2b5","http://www.politifact.com/rhode-island/statements/2013/oct/27/diane-ravitch/education-critic-diane-ravitch-says-test-scores-we/","Diane Ravitch","'Test scores had gone up steadily for 40 years until No Child Left Behind and Race to the Top.'","Education critic Diane Ravitch says test scores went up for 40 years until federal No Child Left Behind, Race to the Top initiatives","Bush Administration",2013-10-15
"http://data.gesis.org/claimskg/creative_work/9371241c-8c3a-506f-9235-44b67388f5a4","http://www.politifact.com/wisconsin/statements/2019/jun/14/ray-cross/uw-system-president-hits-pay-dirt-university-pay-g/","Ray Cross","'Most research shows that (UW salaries) are a little behind, and (in) some areas we're behind more than others.'","UW System president hits pay dirt with university pay gap claim","State government spending,State Budget",2019-05-26
"http://data.gesis.org/claimskg/creative_work/e5f03a79-c828-5286-a34f-65d409000e13","http://www.politifact.com/texas/statements/2011/apr/09/donna-howard/state-rep-donna-howard-says-50-percent-students-wh/","Donna Howard","'Fifty percent of our students who enter higher education need to take remedial courses because they are not prepared for college-level work.'","State Rep. Donna Howard says 50 percent of students who enter higher ed aren't prepared for college-level work and require remedial courses","State Budget",2011-04-03
"http://data.gesis.org/claimskg/creative_work/458e43c1-c775-596b-b123-5c4e2fba7529","http://www.politifact.com/tennessee/statements/2012/nov/11/bill-haslam/tennessees-outcomes-based-college-funding-model-al/","Bill Haslam","Says Tennessee’s higher education funding model 'is 100 percent outcomes-based' and 'we are already seeing this model changing the way our postsecondary institutions do business.'","Tennessee’s outcomes-based college funding model already “changing the way our postsecondary institutions do business,” says Haslam","State Budget",2012-10-18
"http://data.gesis.org/claimskg/creative_work/c0902a27-43eb-59fc-8857-e725b32b62aa","http://www.politifact.com/new-jersey/statements/2012/oct/28/tom-kean-jr/tom-kean-claims-new-jersey-was-only-state-nation-r/","Tom Kean Jr.","'New Jersey is the only state in the union that spent less on higher education than it did at the beginning of the decade.'","Tom Kean claims only New Jersey decreased higher education aid over last decade","State Finances",2012-10-17
"http://data.gesis.org/claimskg/creative_work/0a5ec0c8-3df5-5e7e-9bc9-40034136265e","http://www.politifact.com/california/statements/2018/nov/05/students-parents-and-teachers-supporting-marshall-/false-attack-ads-claim-tony-thurmond-was-sued-aclu/","Students, Parents and Teachers supporting Marshall Tuck","Says Tony Thurmond was 'sued by the ACLU' for leaving students in unsafe conditions.","FALSE: Attack ad’s claim Tony Thurmond was ‘sued by the ACLU’","Elections",2018-10-11
"http://data.gesis.org/claimskg/creative_work/7e42de3e-e979-5e57-a075-05848f9a44c8","http://www.politifact.com/truth-o-meter/statements/2015/jun/15/hillary-clinton/hillary-clinton-top-hedge-fund-managers-make-more-/","Hillary Clinton","'The top 25 hedge fund managers (are) making more than all of America's kindergarten teachers combined.'","Hillary Clinton: Top hedge fund managers make more than all kindergarten teachers combined","Income,Wealth",2015-06-13
"http://data.gesis.org/claimskg/creative_work/38f6a6fc-2b0d-50c0-b2a3-c0073c4c438c","http://www.politifact.com/texas/statements/2012/aug/28/jerry-patterson/jerry-patterson-says-investments-overseen-his-offi/","Jerry Patterson","Says a portfolio managed by the Texas General Land Office earned 22 percent last year while the state’s emergency reserve account experienced a 1 percent gain.","Jerry Patterson says investments overseen by his office enjoyed 22 percent in earnings while state's emergency reserve earned 1 percent","State Finances,State Budget",2012-08-22
"http://data.gesis.org/claimskg/creative_work/3d1f72eb-d67a-53f4-8eed-a0de4067f7b3","http://www.politifact.com/virginia/statements/2016/apr/18/jack-berry/jack-berry-error-about-richmond-teacher-raises/","Jack Berry","Richmond teachers have not gotten a raise 'for almost 10 years.'","Jack Berry in error about Richmond teacher raises","Income",2016-04-06
"http://data.gesis.org/claimskg/creative_work/a9c1f4a0-d73c-5f44-ba0a-c18e80b65a40","http://www.politifact.com/new-jersey/statements/2013/may/26/barbara-buono/barbara-buono-tv-ad-goes-after-chris-christie-jobs/","Barbara Buono","'To hear Gov. Christie tell it, everything in New Jersey is going just fine. Well I see another New Jersey with 400,000 unemployed. One of the worst jobless rates in the country. Working and middle class families have seen costs soar, from property taxes to college tuition.'","Barbara Buono TV ad goes after Chris Christie on jobs, property taxes","Jobs",2013-05-22
"http://data.gesis.org/claimskg/creative_work/21be5e14-44db-5e8e-a3ee-025e6cca46a2","http://www.politifact.com/new-jersey/statements/2012/apr/05/chris-christie/chris-christie-claims-nonmembers-njea-must-pay-85-/","Chris Christie","'To get out of the (teachers) union, you pay 85 percent of $731. Then you're out of the union, but you've got to pay it every year, also required by statute. That’s called a representation fee.'","Chris Christie claims nonmembers of the NJEA must pay 85 percent of annual dues","Unions",2012-03-23
"http://data.gesis.org/claimskg/creative_work/19640f26-afab-5c6f-add4-f68223936e09","http://www.politifact.com/florida/statements/2017/apr/05/volusia-county-republican-party/did-us-department-education-introduce-islamic-indo/","Volusia County Republican Party","'The United States Department of Education has introduced an Islamic indoctrination program for the public schools, called ‘Access Islam.’ '","Did the U.S. Education Department introduce an Islamic indoctrination program for public schools?","Islam,Religion",2017-04-02
"http://data.gesis.org/claimskg/creative_work/607ab29e-2f56-54f6-924f-8951326aec05","http://www.politifact.com/truth-o-meter/statements/2011/apr/15/chris-van-hollen/chris-van-hollen-says-gop-has-demanded-deep-cuts-e/","Chris Van Hollen","'The Republicans have demanded deep cuts in education. They've demanded cuts in cancer research and other research to find cures and treatments to diseases.'","Chris Van Hollen says GOP has """"demanded deep cuts"""" in education, disease research","Federal Budget,Science,This Week - ABC News",2011-04-10
"http://data.gesis.org/claimskg/creative_work/354d1398-228a-54c8-8065-b9d9ea396f14","http://www.politifact.com/new-jersey/statements/2011/jul/11/jim-whelan/state-sen-jim-whelan-says-gov-chris-christie-slash/","Jim Whelan","'In our proposal, we would have expanded school aid across the board … Governor Christie slashed school aid in this budget, preferring instead to extend a tax break for millionaires over funding in the classroom.'","State Sen. Jim Whelan says Gov. Chris Christie """"slashed school aid in this budget""""","State Budget",2011-07-05
"http://data.gesis.org/claimskg/creative_work/fb6ea8e4-90ce-5b55-a462-98cff9c50d6f","http://www.politifact.com/wisconsin/statements/2018/sep/20/tony-evers/evers-special-education-funding-claim-passes-test/","Tony Evers","'Special education categorical aid' from the state 'hasn’t been raised in over a decade.'","Evers' special education funding claim passes the test","Children,State Budget",2018-08-16
"http://data.gesis.org/claimskg/creative_work/db7c8663-878f-5fb1-a87b-d0c5889a8498","http://www.politifact.com/ohio/statements/2012/jul/02/dan-ramos/dan-ramos-says-lorain-poorest-school-district-ohio/","Dan Ramos","Lorain 'is the poorest urban school district in the state of Ohio.'","Dan Ramos says Lorain is the poorest school district in Ohio","Poverty,State Budget",2012-06-13
"http://data.gesis.org/claimskg/creative_work/0782fc81-1567-56da-8eb3-bd5f12d0d190","http://www.politifact.com/rhode-island/statements/2011/aug/07/daniel-mckee/cumberland-mayor-mckee-says-rhode-island-giving-ce/","Daniel McKee","Central Falls 'schools are overfunded by state money by as much as $8 million.'","Cumberland Mayor McKee says Rhode Island is giving the Central Falls school system $8 million more than it should","State Finances,Bankruptcy,City Budget",2011-08-02
"http://data.gesis.org/claimskg/creative_work/904a313d-823e-55c9-bcc0-86f169466d07","http://www.politifact.com/california/statements/2017/oct/27/delaine-eastin/do-millennials-have-only-50-50-chance-doing-better/","Delaine Eastin","'Ninety percent of people born in the 1940s ended up doing better financially than their parents. But those born in the 1980s, the much-maligned Millennials, have only a 50-50 chance of doing better (financially) than their parents, despite being the best-educated generation in our history.'","Do millennials have ‘only a 50-50 chance’ of doing better financially than their parents?","Jobs,The 2018 California Governor's Race",2017-10-11
"http://data.gesis.org/claimskg/creative_work/e90bef76-63d3-5b62-9d98-4088762f8e00","http://www.politifact.com/florida/statements/2014/dec/09/jeb-bush/jeb-bush-says-only-35-40-percent-pass-military-ent/","Jeb Bush","'The pass rate for a high school level test to join the military' is 35 to 40 percent.","Jeb Bush says only 35 to 40 percent pass military entrance exam","Military",2014-12-01
"http://data.gesis.org/claimskg/creative_work/336f7f40-3076-54a3-a078-80cc665fbe8c","http://www.politifact.com/texas/statements/2013/apr/16/mike-villarreal/mike-villarreal-says-2011-legislature-imposed-phys/","Mike Villarreal","Says Texas lawmakers in 2011 ordered school districts to test every student on their respiratory system and weight.","Mike Villarreal says 2011 Legislature imposed physical fitness tests on Texas school kids","Children,Recreation",2013-04-04
"http://data.gesis.org/claimskg/creative_work/40ff9228-8a9e-554f-a05b-c26129229de9","http://www.politifact.com/georgia/statements/2013/aug/02/don-lemon/educational-levels-generally-make-difference-earni/","Don Lemon","'A high school dropout makes on average $19,000 a year, a high school graduate makes $28,000 a year, a college graduate makes $51,000 a year.'","Educational levels generally make a difference in earnings","Pundits",2013-07-27
"http://data.gesis.org/claimskg/creative_work/cafea890-0805-545a-9eaf-be825949a4f8","http://www.politifact.com/oregon/statements/2012/jun/29/ron-wyden/ron-wyden-says-food-served-oregon-schools-comes-al/","Ron Wyden","'Oregon schools receive millions of dollars per year in federal school lunch assistance and yet they are required to spend that money almost anywhere but Oregon.'","Ron Wyden says food served in Oregon schools comes from 'almost anywhere but Oregon'","Federal Budget,Congress",2012-06-20
"http://data.gesis.org/claimskg/creative_work/4ecac7a2-02ed-5ac4-9846-a443ab9ea97e","http://www.politifact.com/texas/statements/2014/may/02/republican-party-texas/early-campaign-wendy-davis-has-not-raised-more-thr/","Republican Party of Texas","'Wendy Davis has already taken more $ from teacher unions than the past 3 Democrat gubernatorial candidates combined.'","Early in campaign, Wendy Davis has not raised more from three teacher groups than previous Democratic gubernatorial nominees combined","Campaign Finance",2014-04-11
"http://data.gesis.org/claimskg/creative_work/6304b772-17db-5357-ad31-ee86ce4b1cff","http://www.politifact.com/wisconsin/statements/2013/apr/15/george-will/wisconsin-dpi-urged-white-students-wear-white-priv/","George Will","Wisconsin education agency 'urged white students to wear white wristbands ‘as a reminder about your (white) privilege.’ '","Wisconsin DPI urged white students to wear """"white privilege"""" wristbands, George Will says","Children,Diversity",2013-04-03
"http://data.gesis.org/claimskg/creative_work/98606e7e-d7ba-5b90-82dc-5fa798f35bda","http://www.politifact.com/texas/statements/2011/apr/04/jimmie-don-aycock/texas-rep-jimmie-don-aycock-says-some-colleges-inc/","Jimmie Don Aycock","'Some of the colleges, including A&M, have already guaranteed that they will not increase their tuition.'","Texas Rep. Jimmie Don Aycock says """"some of the colleges, including A&M,"""" have guaranteed tuition freeze","State Budget",2011-03-31
"http://data.gesis.org/claimskg/creative_work/e20ad2a0-303f-5f27-82c6-50f05460a39f","http://www.politifact.com/wisconsin/statements/2017/may/31/mark-pocan/mark-pocans-errant-claim-about-tax-breaks-wisconsi/","Mark Pocan","In Wisconsin’s school voucher program, 'two-thirds of the money' in the 'tax vouchers' went to people 'making more than $100,000.'","Mark Pocan's errant claim about tax breaks in Wisconsin's school voucher program for low-income kids","State government spending,Urban,Poverty,State Budget",2017-05-24
"http://data.gesis.org/claimskg/creative_work/37755d25-4cae-5885-a45b-a17242ea6999","http://www.politifact.com/wisconsin/statements/2011/apr/01/jeff-stone/jeff-stone-says-chris-abele-opponent-milwaukee-cou/","Jeff Stone","Says Chris Abele, opponent in Milwaukee County executive race, 'failed to finish 3 separate colleges, dropping out all 3 times.'","Jeff Stone says Chris Abele, opponent in Milwaukee County executive race, dropped out of three separate colleges","Candidate Biography",2011-04-01
"http://data.gesis.org/claimskg/creative_work/3c1693fa-5012-57ae-9e13-d76653419222","http://www.politifact.com/truth-o-meter/statements/2019/apr/26/justice-democrats/biden-draws-barbs-progressive-democratic-organizat/","Justice Democrats","Says Joe Biden 'voted for the Iraq War, for mass incarceration, and for the Bankruptcy Reform Act while voting against gay marriage, reproductive rights, and school desegregation.'","Progressive Democratic group's attack on Joe Biden's voting record needs some context","Financial Regulation,Iraq,Civil Rights,Abortion",2019-04-25
"http://data.gesis.org/claimskg/creative_work/1350588a-4263-59bd-9ce2-af6e3704dce0","http://www.politifact.com/texas/statements/2017/jul/19/joe-straus/joe-straus-says-austin-school-district-expected-lo/","Joe Straus","'One' Texas school 'district alone -- Austin ISD -- is expected to lose more than $530 million in local property taxes to Robin Hood this year.'","Joe Straus says Austin school district expected to lose $530-million-plus to fund other schools","State government spending,State Finances,State Budget",2017-07-16
"http://data.gesis.org/claimskg/creative_work/d2369d03-0362-5186-b941-7a637cdfe8e6","http://www.politifact.com/truth-o-meter/statements/2014/feb/28/louise-slaughter/louise-slaughter-tweets-four-five-black-and-hispan/","Louise Slaughter","Says 'by 4th grade, 86 percent of African-American boys and 82 percent (of) Hispanic boys are reading below proficiency levels.'","Louise Slaughter tweets that four-in-five black and Hispanic fourth-graders aren't proficient in reading","Diversity",2014-02-27
"http://data.gesis.org/claimskg/creative_work/90a1727d-cbd4-5008-87a7-5988176d4e1d","http://www.politifact.com/virginia/statements/2012/jun/18/george-allen/george-allen-says-he-froze-college-tuition-when-he/","George Allen","'Before I was governor, tuition was skyrocketing and we stopped that. We capped and then we froze college tuition.'","George Allen says he froze college tuition when he was governor","Job Accomplishments,State Budget",2012-05-25
"http://data.gesis.org/claimskg/creative_work/a90288c4-efc5-534f-a6be-cc30070fcdf8","http://www.politifact.com/wisconsin/statements/2013/nov/06/janet-bewley/despite-100-million-property-tax-relief-wisconsin-/","Janet Bewley","'The Legislature passed Gov. Walker’s so-called property tax relief bill,' but the Republicans 'are still raising your property taxes.'","Despite $100 million in property tax relief, Wisconsin Republicans are still raising property taxes?","State Finances,City Government,County Government,State Budget",2013-10-24
"http://data.gesis.org/claimskg/creative_work/d1754a86-2abd-5f59-869e-f0974eb8ffaf","http://www.politifact.com/new-hampshire/statements/2017/apr/17/jeb-bush/does-school-competition-lift-all-boats-jeb-bush-sa/","Jeb Bush","'When public schools face increased competition, they get better and kids learn more.'","Does school competition lift all boats like Jeb Bush says?","Government regulation",2017-04-06
"http://data.gesis.org/claimskg/creative_work/36899648-221c-54c1-86eb-9bc7e171d58d","http://www.politifact.com/global-news/statements/2016/aug/01/tina-rosenberg/are-liberian-girls-more-likely-be-married-literate/","Tina Rosenberg","In Liberia, 'a girl is more likely to be married by 18 than to know how to read.'","Are Liberian girls more likely to be married than literate by the age of 18?","Children,Women",2016-06-14
"http://data.gesis.org/claimskg/creative_work/60737b13-cbb4-5a87-8d20-248b7d9f79ea","http://www.politifact.com/texas/statements/2018/may/16/lupe-valdez/lupe-valdez-says-texas-schools-some-counties-shut-/","Lupe Valdez","'There are some counties in Texas where the first day of hunting, you have to shut down the schools because people are going to go hunting.'","Lupe Valdez says Texas schools in some counties shut down for opening of hunting season","Children,Recreation",2018-05-08
"http://data.gesis.org/claimskg/creative_work/3a376e99-cb24-5e60-87af-76b21c8bdf50","http://www.politifact.com/new-york/statements/2019/apr/20/donald-trump/trump-calls-out-ny-dems-vote-expansion-military-be/","Donald Trump","'In New York State, Democrats blocked a Bill expanding College Tuition for Gold Star families after approving aid for illegal immigrants.'","Trump calls out N.Y. Dems for vote on expansion of military benefits","State government spending,Military,State Budget",2019-04-12
"http://data.gesis.org/claimskg/creative_work/cd5d58d6-7e67-5437-a007-b97c1ad68789","http://www.politifact.com/new-york/statements/2017/jan/09/andrew-cuomo/more-college-graduates-living-home-decades/","Andrew Cuomo","'More college graduates are living at home than in decades.'","More college graduates living at home than in decades","Debt,Housing",2017-01-09
"http://data.gesis.org/claimskg/creative_work/08d3a4f1-3d82-5471-b53b-f63ca6e1b76e","http://www.politifact.com/punditfact/statements/2017/mar/07/social-media/social-media-post-pending-gop-bills-largely-accura/","Social Media","'It's important to pay attention to the Russian spy drama, but let's not ignore the fact that the following (10) bills have been introduced' in the House.","Social media post on pending GOP bills is largely accurate","Environment,Workers,Foreign Policy,Abortion",2017-03-06
"http://data.gesis.org/claimskg/creative_work/7794bdac-ec1b-530e-a927-ed29a50890cd","http://www.politifact.com/truth-o-meter/statements/2015/nov/11/marco-rubio/marco-rubio-welders-more-money-philosophers/","Marco Rubio","'Welders make more money than philosophers.'","Marco Rubio said wrongly that welders make more money than philosophers","Income,Jobs",2015-11-10
"http://data.gesis.org/claimskg/creative_work/d7f56f1f-5771-5264-b4dc-5175f6d23634","http://www.politifact.com/rhode-island/statements/2014/feb/23/clay-pell/rhode-island-gubernatorial-candidate-clay-pell-say/","Clay Pell","'The budget I managed at the Department of Education was more than $60 million.'","Rhode Island gubernatorial candidate Clay Pell says he oversaw a budget of more than $60 million while at the U.S. Department of Education","Job Accomplishments,Federal Budget,Candidate Biography",2014-02-02
"http://data.gesis.org/claimskg/creative_work/19f93a2d-cd2c-5608-aef1-72c7bafe90ce","http://www.politifact.com/texas/statements/2016/jun/10/austin-independent-school-district/austin-districts-claim-highest-graduation-rate-amo/","Austin Independent School District","'Austin ISD has the highest graduation rate of every major city in Texas.'","Austin district's claim to highest graduation rate among major Texas cities Mostly False","Children",2016-06-02
"http://data.gesis.org/claimskg/creative_work/c162aba4-ca8a-5bae-a132-edc9de77591b","http://www.politifact.com/texas/statements/2013/feb/08/sacramento-bee-editorial-board/sacramento-bee-editorial-says-texas-ranks-last-res/","Sacramento Bee Editorial Board","Says Texas ranks last in the percentage of residents with high school diplomas.","Sacramento Bee editorial says Texas ranks last in residents with high school diplomas","Pundits",2013-02-06
"http://data.gesis.org/claimskg/creative_work/cb77c8ed-e61b-594a-b021-805d5ca9193e","http://www.politifact.com/florida/statements/2016/feb/09/bernie-sanders/was-college-once-free-united-states-and-it-oversea/","Bernie Sanders","'Making public colleges and universities tuition-free, that exists in countries all over the world, used to exist in the United States.'","Was college once free in United States, as Bernie Sanders says?","History",2016-02-04
"http://data.gesis.org/claimskg/creative_work/404846e1-852d-55b4-a315-0c6765bd944e","http://www.politifact.com/wisconsin/statements/2012/feb/05/fred-clark/democratic-state-rep-fred-clark-says-gov-scott-wal/","Fred Clark","Says Gov. Scott Walker 'made more than $70 million in cuts to job training programs through (Wisconsin’s) technical colleges.'","Democratic state Rep. Fred Clark says Gov. Scott Walker cut technical college job training by $70 million","Jobs,State Budget",2012-02-01
"http://data.gesis.org/claimskg/creative_work/a53f216f-2d16-56aa-b294-cd0bf0059094","http://www.politifact.com/wisconsin/statements/2018/oct/31/tony-evers/gubernatorial-candidate-tony-evers-ad-inflates-his/","Tony Evers","Says he 'raised graduation rates to nearly 90 percent.'","Gubernatorial candidate Tony Evers ad inflates his grade on raising graduation rates to nearly 90%","Children",2018-09-25
"http://data.gesis.org/claimskg/creative_work/e4ad31fd-cb8e-55f5-9439-a94531eb65b1","http://www.politifact.com/texas/statements/2011/sep/28/rick-perry/rick-perry-says-only-four-texas-lawmakers-opposed-/","Rick Perry","Says only four Texas legislators voted against a law giving in-state tuition rates to certain illegal immigrants.","Rick Perry says only four Texas lawmakers opposed in-state tuition law for illegal immigrants","States",2011-09-28
"http://data.gesis.org/claimskg/creative_work/2bd169c2-5776-5f9b-b39d-e17da486bc22","http://www.politifact.com/texas/statements/2010/dec/10/organizing-america/arm-democratic-national-committee-says-americans-o/","Organizing for America","'An overwhelming majority of Americans support passage of the DREAM Act, which would provide a path to citizenship for undocumented youth willing to work for a college degree or serve in our armed forces.'","Arm of Democratic National Committee says Americans """"overwhelmingly"""" support passage of DREAM Act","Families,Military",2010-12-06
