"claim","review_url","claimer","text","headline","keywords","claim_date"
"http://data.gesis.org/claimskg/creative_work/1dcc7ba4-8990-5486-bb5d-60e38f0cb244","http://www.politifact.com/truth-o-meter/statements/2018/feb/01/john-calipari/college-basketball-graduation-rate-all-time-high-j/","John Calipari","'We have the highest graduation rate of basketball players in the history of the NCAA. We have the highest graduation rate of African-American basketball players in the history of the NCAA in basketball.'","Are college basketball graduation rates at an all-time high, as John Calipari said?","Sports",2018-01-20
"http://data.gesis.org/claimskg/creative_work/1eaf1d53-61a2-58ca-b3fd-e10a7480d8a4","http://www.politifact.com/wisconsin/statements/2019/mar/12/tony-evers/wisconsin-governor-takes-half-step-phasing-out-sch/","Tony Evers","On phasing out the private-school voucher program in his first budget","Wisconsin governor takes half-step back on phasing out school vouchers","Children,Disability,State Budget",2019-02-19
"http://data.gesis.org/claimskg/creative_work/305fbdf0-d6e2-5ae9-b5dd-4514d2bed980","http://www.politifact.com/virginia/statements/2016/jul/05/pat-robertson/pat-robertson-misleadingly-says-obama-was-schooled/","Pat Robertson","President Barack Obama attended  'an Islamic madrassa.'","Pat Robertson misleadingly says Obama was schooled at 'Islamic madrassa'","Islam",2016-06-27
"http://data.gesis.org/claimskg/creative_work/171a1847-c7e0-5545-aaa2-6036cc8b4405","http://www.politifact.com/wisconsin/statements/2014/apr/06/scott-walker/scott-walker-says-recent-wisconsin-poll-shows-70-a/","Scott Walker","A poll taken 'a few months ago' found '70 percent approval or higher' for the Act 10 collective bargaining law.","Scott Walker says recent Wisconsin poll shows 70% approval for collective bargaining law that led to massive protests, recall election","State Finances,City Government,County Government,Polls and Public Opinion,Unions,Pensions,State Budget",2014-04-01
"http://data.gesis.org/claimskg/creative_work/675af0f5-2786-5d60-b0c2-9b72b3241c62","http://www.politifact.com/truth-o-meter/statements/2016/aug/17/hillary-clinton/hillary-clintons-claim-she-would-make-biggest-jobs/","Hillary Clinton","Says her campaign platform includes the 'biggest investment in new, good-paying jobs since World War II.'","Hillary Clinton's claim that she would make the biggest jobs investment since World War II","Income,Infrastructure,Federal Budget,Energy,Technology,Jobs",2016-08-15
"http://data.gesis.org/claimskg/creative_work/75e4922f-ac79-5801-8196-409579c7aad8","http://www.politifact.com/wisconsin/statements/2014/dec/12/glenn-grothman/can-single-mother-wisconsin-easily-get-35000-year-/","Glenn Grothman","'A single parent with a couple kids can easily get $35,000 a year' in public assistance in Wisconsin.","Can a single parent in Wisconsin easily get $35,000 per year in government benefits?","Children,Welfare,Housing",2014-11-30
"http://data.gesis.org/claimskg/creative_work/ca9a3815-c82e-55e7-ab4a-d5d5932780a6","http://www.politifact.com/texas/statements/2011/feb/26/jeff-wentworth/state-sen-jeff-wentworth-says-texas-universities-d/","Jeff Wentworth","'We don’t have bars on campus in Texas. It’s against the law... no alcohol allowed.'","State Sen. Jeff Wentworth says Texas universities don't have bars on campus because it's against the law","Guns,Alcohol",2011-02-22
"http://data.gesis.org/claimskg/creative_work/cc343ecd-2654-5c91-b2e4-4d277772ebd0","http://www.politifact.com/wisconsin/statements/2014/may/28/mary-burke/no-evidence-students-voucher-schools-perform-bette/","Mary Burke","The Wisconsin school voucher program 'has no research that shows that it’s going to improve student learning.'","No evidence that choice students outperform public school students, Mary Burke says","Children,Religion,Poverty,State Budget",2014-05-06
"http://data.gesis.org/claimskg/creative_work/7d1edda9-fb56-584d-88ba-cde7307e311c","http://www.politifact.com/florida/statements/2010/feb/06/franklin-sands/florida-democrat-says-state-last-among-southeast-s/","Franklin Sands","'Florida still averages more students in its classrooms than any other state in the Southeast.'","Florida Democrat says state last among Southeast states in average class size","Florida",2010-01-29
"http://data.gesis.org/claimskg/creative_work/ef5eca87-40cc-57cd-a2ae-96af7708c973","http://www.politifact.com/truth-o-meter/statements/2016/jul/21/mike-pence/mike-pence-stretches-claim-record-education-spendi/","Mike Pence","Says as Indiana governor, he has made 'record investments in education.'","Mike Pence stretches claim of record education spending in Indiana at Republican convention","State Budget",2016-07-20
"http://data.gesis.org/claimskg/creative_work/5a45e0eb-2b93-563e-a5af-eab6a288193d","http://www.politifact.com/wisconsin/statements/2015/feb/06/tweets/scott-walker-wants-cut-college-budgets-13-and-spen/","Tweets","'Scott Walker to cut $300 million from universities, spend $500 million on a pro basketball stadium.'","Scott Walker wants to cut college budgets by 13% and spend $500 million for an NBA arena?","Sports,State Budget",2015-02-02
"http://data.gesis.org/claimskg/creative_work/c5174567-70a2-57bc-ab21-0da91f0763ca","http://www.politifact.com/truth-o-meter/statements/2018/feb/26/patrick-morrisey/precedent-says-west-virginia-teachers-strike-isnt-/","Patrick Morrisey","'The impending work stoppage is unlawful.'","Precedent says West Virginia teacher's strike isn't lawful","Workers,Legal Issues",2018-02-21
"http://data.gesis.org/claimskg/creative_work/a9657a13-2fd4-5c73-a6bf-b26cdec7a166","http://www.politifact.com/texas/statements/2013/dec/08/david-dewhurst/dewhurst-didnt-personally-cut-taxes-and-some-incre/","David Dewhurst","'I have cut taxes 63 times, including a 2006 property tax reduction that ranks as the largest in state history.'","Dewhurst didn't personally cut taxes--and some increased","Small Business,Candidate Biography",2013-10-01
"http://data.gesis.org/claimskg/creative_work/99e0baf1-2096-53d5-9f0f-04804accfdc7","http://www.politifact.com/florida/statements/2013/jul/16/kathleen-ford/kathleen-ford-says-private-prisons-use-third-grade/","Kathleen Ford","'Private prison systems are calculating how many new beds (they will need) based on the ... number of third graders.'","Kathleen Ford says private prisons use third-grade data to plan for prison beds","Crime",2013-06-27
"http://data.gesis.org/claimskg/creative_work/e01b2984-e3f0-5ded-a8b4-dacacd36e2a8","http://www.politifact.com/florida/statements/2014/jul/18/charlie-crist/rick-scotts-student-spending-about-200-less-during/","Charlie Crist","Says Rick Scott’s per-pupil education spending is 'about $200 less' than what it was under Charlie Crist during the recession.","Rick Scott's student spending is 'about $200 less' than during recession, Charlie Crist says","State Budget",2014-07-16
"http://data.gesis.org/claimskg/creative_work/3d4eb3f3-bb6f-5d0e-9718-269ec05f838f","http://www.politifact.com/texas/statements/2018/mar/02/greg-abbott/greg-abbott-says-texas-ranks-among-5-top-states-it/","Greg Abbott","Says Texas ranks among the nation’s top five states for its high school graduation rate.","Greg Abbott says Texas ranks among 5 top states for its high-school graduation rate","Children",2018-02-19
"http://data.gesis.org/claimskg/creative_work/973e4789-6ae9-590d-b20f-9ed4a1874d14","http://www.politifact.com/texas/statements/2016/nov/16/donna-howard/donna-howard-says-31-percent-texas-school-district/","Donna Howard","'Thirty-one percent of school districts are still receiving less funding per pupil than they did prior to the dramatic budget cuts of 2011.'","Donna Howard says 31 percent of Texas school districts getting less per student than in 2011","State Finances,State Budget",2016-09-19
"http://data.gesis.org/claimskg/creative_work/98243561-a616-5434-9bb2-d25659d29428","http://www.politifact.com/texas/statements/2017/jul/27/dan-patrick/dan-patrick-says-32-percent-texas-public-school-sp/","Dan Patrick","'Of all the money we spend on education, less than 32 percent goes to teachers.'","Dan Patrick says 32 percent of Texas public school spending goes to teacher salaries","State government spending,State Finances,State Budget",2017-07-13
"http://data.gesis.org/claimskg/creative_work/5b9d0211-e75f-5631-a3c4-db8e05e66376","http://www.politifact.com/wisconsin/statements/2018/aug/01/mahlon-mitchell/mahlon-mitchell-has-point-mostly-misses-his-attack/","Mahlon Mitchell","Says Scott Walker 'has cut more from public education than he's put back in, obviously. He took $1.6 billion and some change away and then puts back $630 million and he's calling that progress.'","Mahlon Mitchell has a point, but mostly misses in his attack on Scott Walker over school funding","State government spending,State Budget",2018-06-19
"http://data.gesis.org/claimskg/creative_work/e473e39b-25cf-5328-9039-a7229961d968","http://www.politifact.com/truth-o-meter/statements/2009/feb/13/jim-demint/demint-stimulus-prayer-dorms-religion/","Jim DeMint","There is a provision in the economic stimulus plan that means that 'students cannot meet together in their dorms, if that dorm has been repaired with this federal money, and have a prayer group or a Bible study.'","DeMint says stimulus plan would bar students from having prayer meetings in dorms","Stimulus",2009-02-05
"http://data.gesis.org/claimskg/creative_work/c9abd48b-afe0-52c0-95c7-2eb29869abe2","http://www.politifact.com/global-news/statements/2016/jun/24/tim-kaine/more-schooling-reduces-hiv-risk-how-much/","Tim Kaine","'For every extra year that a girl stays in secondary school, her chance of getting infected with HIV/AIDS decreases by half.'","More schooling reduces HIV risk. But by how much?","Foreign Policy,Women",2016-06-15
"http://data.gesis.org/claimskg/creative_work/69a1e15d-9430-5b2c-baec-d40ef51ec0ed","http://www.politifact.com/north-carolina/statements/2016/mar/21/roy-cooper/cooper-says-north-carolinas-education-spending-stu/","Roy Cooper","'North Carolina spends $855 less per student than it did before the Great Recession, and we have one of the lowest per pupil spending levels in the nation.'","Cooper says North Carolina's education spending per student hasn't bounced back since the recession","State Budget",2016-03-08
"http://data.gesis.org/claimskg/creative_work/fd286c95-892f-587b-a3e9-cedd56fd5860","http://www.politifact.com/wisconsin/statements/2018/sep/13/scott-walker/scott-walker-misleads-claiming-tony-evers-could-ha/","Scott Walker","'A teacher watched hard-core pornography in his classroom,' along with other inappropriate behavior, but Tony Evers didn't revoke the teacher's license and 'the teacher is still in the classroom.'","Scott Walker misleads in claiming Tony Evers could have revoked teacher license in porn viewing case","Children,Sexuality,Government regulation",2018-09-05
"http://data.gesis.org/claimskg/creative_work/688250e6-4245-5865-8fbf-03adca5f7f67","http://www.politifact.com/california/statements/2017/may/05/antonio-villaraigosa/villaraigosas-mostly-true-claim-about-rise-school-/","Antonio Villaraigosa","'When I became mayor of Los Angeles, we had a 44 percent (high school) graduation rate. I said that was unacceptable. I challenged that notion. I said the mayor needs to be involved with our schools. We need to partner together. As I left, after a number of reforms, we grew our graduation rate from 44 percent to 72.'","Villaraigosa’s Mostly True claim about the rise in school graduation rates","The 2018 California Governor's Race",2017-03-23
"http://data.gesis.org/claimskg/creative_work/736ed6ec-fea9-5f9e-afb2-f57122874f8d","http://www.politifact.com/texas/statements/2015/nov/06/greenville-gazette/website-says-texas-legislation-allows-teachers-kil/","Greenville Gazette","Texas legislation 'would allow… teachers to kill their students if they felt it was needed.'","Website says Texas legislation allows teachers to kill students if 'they felt it was needed'","Children,Crime,Criminal Justice",2015-02-01
"http://data.gesis.org/claimskg/creative_work/f8d10e7f-e36e-5144-b43e-e27826019185","http://www.politifact.com/wisconsin/statements/2016/oct/28/our-democracy-2020/did-wisconsin-election-clerk-block-early-voting-be/","Our Democracy 2020","Says an election clerk in Green Bay refused to allow early voting on the UW-Green Bay campus because she 'was afraid it would help Democrats,' showing 'outrageous partisan bias.'","Did a Wisconsin election clerk block early voting because of 'partisan bias' against Democrats?","Bipartisanship,Elections,City Government",2016-10-26
"http://data.gesis.org/claimskg/creative_work/1ed974b0-dbc3-5a32-b229-f0ceba5b29b4","http://www.politifact.com/ohio/statements/2010/nov/26/armond-budish/rep-armond-budish-touts-democrat-efforts-jobs-educ/","Armond Budish","'We (Democrats) have made steady progress creating jobs and improving our schools.'","Rep. Armond Budish touts Democrat efforts on jobs, education as successes","Job Accomplishments,Government Efficiency,Jobs",2010-11-17
"http://data.gesis.org/claimskg/creative_work/2281d775-7460-5287-adfb-b08fdda52d3b","http://www.politifact.com/west-virginia/statements/2019/apr/24/e-gordon-gee/does-west-virginia-trail-its-neighbors-stem-gradua/","E. Gordon Gee","'Our state has fewer science, technology, engineering and math graduates than any neighboring state.'","Does West Virginia trail its neighbors in STEM graduates?","Science,Technology",2019-03-19
"http://data.gesis.org/claimskg/creative_work/a5cbfa02-4fbd-585f-956e-1ca2c4ca18fc","http://www.politifact.com/georgia/statements/2013/feb/19/barack-obama/does-obama-get-education-claim/","Barack Obama","'Every dollar we invested in high-quality, early education programs can save more than $7 later on by boosting graduation rates, reducing teen pregnancy, even reducing crime.'","Does Obama get an A for early care claim?","Children",2013-02-12
"http://data.gesis.org/claimskg/creative_work/707e1ae2-282c-50f7-81d8-57311fde67cc","http://www.politifact.com/truth-o-meter/statements/2010/aug/31/jamie-oliver/chef-jamie-oliver-praises-mcdonalds-england/","Jamie Oliver","McDonald's in England only sells organic milk and free-range eggs, which provides more nutritious offerings than in the U.S.","Chef Jamie Oliver praises McDonald's in England","This Week - ABC News,Food Safety",2010-08-29
"http://data.gesis.org/claimskg/creative_work/198408a4-4c79-52d3-b23e-fd446b004c22","http://www.politifact.com/florida/statements/2012/jan/24/newt-gingrich/newt-gingrich-miami-dade-college-students-speak-86/","Newt Gingrich","There are 86 languages spoken at Miami Dade College.","Newt Gingrich says Miami Dade College students speak 86 languages","Diversity",2012-01-23
"http://data.gesis.org/claimskg/creative_work/8c8895fd-cdca-565c-8434-27f1cf4442c3","http://www.politifact.com/virginia/statements/2015/mar/23/ken-plum/ken-plum-says-pre-k-education-leads-fewer-arrests/","Ken Plum","'We've got 40 years of study now that show that, with a good preschool start, you're less likely to be on public dole, you're less likely to be in prison.'","Ken Plum says Pre-K education leads to less crime and welfare","Children,Crime,Welfare",2015-03-12
"http://data.gesis.org/claimskg/creative_work/2ad07deb-b8ad-5d8a-9f32-8a38a5a16658","http://www.politifact.com/wisconsin/statements/2015/mar/09/scott-walker/scott-walker-uw-tuition-will-be-lower-just-about-a/","Scott Walker","The University of Wisconsin System 'will be much more affordable than just about any other campus in America' because 'going forward we have a cap on it tied to inflation.'","Scott Walker: UW tuition will be lower than """"just about any other campus""""","State Budget",2015-03-01
"http://data.gesis.org/claimskg/creative_work/e317862e-dbad-5cb3-b972-105e5c30807d","http://www.politifact.com/texas/statements/2016/nov/18/jennie-lou-leeder/democrat-jennie-lou-leeder-says-texas-spends-more-/","Virginia """"Jennie Lou"""" Leeder","Texas spends 'more per day to house an inmate than we do on a student.'","Democrat Jennie Lou Leeder says Texas spends more per inmate than public school student","State Finances,States,Crime,Criminal Justice,State Budget",2016-10-17
"http://data.gesis.org/claimskg/creative_work/64ede41e-940c-58fa-9617-6bcb91814197","http://www.politifact.com/wisconsin/statements/2014/jul/25/joe-leibham/federal-government-required-states-adopt-common-co/","Joe Leibham","Says Common Core is a federal mandate.","Federal government required states to adopt Common Core school standards, congressional hopeful says","Children,Federal Budget,States",2014-07-19
"http://data.gesis.org/claimskg/creative_work/858b5a7e-701c-5189-bc47-d689c44b4d68","http://www.politifact.com/truth-o-meter/statements/2015/apr/21/hillary-clinton/hillary-clinton-says-us-was-first-create-community/","Hillary Clinton","'The United States invented the community college. Nobody else had ever done anything like it.'","Hillary Clinton says U.S. was first to create community colleges","History",2015-04-21
"http://data.gesis.org/claimskg/creative_work/aae7fe82-5d9c-56f1-abb0-a4001bcf7388","http://www.politifact.com/texas/statements/2017/dec/05/tom-luce/tom-luce-understates-share-texas-students-succeedi/","Tom Luce","'Only 20 percent of our current graduates from Texas high schools go ahead and achieve either a national certificate or a community college degree -- or a college degree.'","Tom Luce understates share of Texas students succeeding in education after high school","Children",2017-11-15
"http://data.gesis.org/claimskg/creative_work/062873d0-cb49-571e-bedd-63676e842aba","http://www.politifact.com/oregon/statements/2013/nov/05/portland-association-teachers/are-portland-public-school-teachers-being-left-beh/","Portland Association of Teachers","Says administrator salaries were increased, 'but other school employees were left behind.'","Are Portland Public School teachers being left behind while administrators see raises?","Unions",2013-10-10
"http://data.gesis.org/claimskg/creative_work/94205489-d5f7-501f-bf29-0d2cb2ae2bda","http://www.politifact.com/truth-o-meter/statements/2016/feb/28/donald-trump/fact-checking-donald-trumps-claims-about-trump-uni/","Donald Trump","'We (Trump University) have an ‘A’ from the Better Business Bureau.'","Fact-checking Donald Trump's claims about Trump University","Corrections and Updates,Candidate Biography",2016-02-28
"http://data.gesis.org/claimskg/creative_work/bffe4bce-f8e1-5c1f-a7fc-726fdef75c7a","http://www.politifact.com/georgia/statements/2014/feb/11/kasim-reed/mayor-working-keep-more-tech-grads/","Kasim Reed","'Right now, we only keep 50 percent of Georgia Tech's graduates.'","Mayor working to keep more Tech grads","Jobs",2014-01-31
"http://data.gesis.org/claimskg/creative_work/f5add041-fa57-5ac1-b3e8-5051e9d676ee","http://www.politifact.com/florida/statements/2011/oct/12/george-lemieux/did-hasner-call-himself-moderate-based-abortion-an/","George LeMieux","Says U.S. Senate candidate Adam Hasner 'cited his efforts to weaken pro-life and school choice legislation as unequivocal proof that he’s a moderate.'","Did Adam Hasner call himself a moderate based on abortion and school choice votes?","Candidate Biography,Abortion",2011-10-03
"http://data.gesis.org/claimskg/creative_work/6941bddd-bd81-57a8-b182-9e7880d51ae9","http://www.politifact.com/missouri/statements/2017/dec/26/parker-briden/governors-spokesman-fudges-education-funding-perfo/","Parker Briden","'We've seen funding increases for schools. We haven't seen a corresponding performance increase.'","Governor's spokesman fudges on education funding, performance","State Budget",2017-11-13
"http://data.gesis.org/claimskg/creative_work/9285e2e8-ff4d-5fc4-bd3a-a3b0e7c809b1","http://www.politifact.com/rhode-island/statements/2011/sep/04/richard-tomlins/robocall-says-cranston-mayoral-academy-would-incre/","Richard Tomlins","'Mayor Fung wants to punish our children's education by removing 12 million dollars from current funding to pay for his private charter school. Your taxes would increase by between 6 and 8 percent per year.'","Robocall says Cranston mayoral academy would increase taxes 6 percent to 8 percent","Children,State Budget,Deficit,City Budget",2011-08-22
"http://data.gesis.org/claimskg/creative_work/3538b1a6-1c1e-54cf-9428-094243284795","http://www.politifact.com/wisconsin/statements/2015/aug/11/facebook-posts/scott-walker-was-asked-leave-marquette-university-/","Facebook posts","Scott Walker 'had a 2.3 GPA when he was asked to leave Marquette University for cheating.'","Meme claims Scott Walker 'was asked to leave Marquette University for cheating'","Elections,Candidate Biography",2015-08-11
"http://data.gesis.org/claimskg/creative_work/9f0886f9-5e7e-5c0e-8a67-602ddef659d3","http://www.politifact.com/truth-o-meter/statements/2017/nov/07/dianne-feinstein/closer-look-classroom-expenses-deduction-teachers-/","Dianne Feinstein","'Teachers spend $1.6 BILLION per year on school supplies. The Republican tax bill ELIMINATES their ability to deduct those expenses.'","A closer look at the classroom-expenses deduction for teachers: How big is it?","Corrections and Updates",2017-11-06
"http://data.gesis.org/claimskg/creative_work/a1ffb3b0-09bb-5f85-b442-7dd5ebb7b9bd","http://www.politifact.com/truth-o-meter/statements/2016/aug/26/hillary-clinton/hillary-clinton-citing-trump-effect-says-teachers-/","Hillary Clinton","'Parents and teachers are already worrying about what they call the ‘Trump Effect.’ They report that bullying and harassment are on the rise in our schools, especially targeting students of color, Muslims and immigrants.'","Hillary Clinton, citing 'Trump Effect,' says teachers are reporting more bullying in schools","Islam",2016-08-25
"http://data.gesis.org/claimskg/creative_work/3f43addd-bf2d-5034-ae21-10b00a6d466f","http://www.politifact.com/wisconsin/statements/2015/jun/19/russ-feingold/ron-johnson-against-all-government-assisted-studen/","Russ Feingold","Says U.S. Senate opponent Ron Johnson 'is opposed to all government-assisted student loans.'","Ron Johnson is against all government-assisted student loans, U.S. Senate rival Russ Feingold says","Financial Regulation,Federal Budget,Debt",2015-06-05
"http://data.gesis.org/claimskg/creative_work/39e4db71-3e0b-5cc1-b024-913cc9adbabf","http://www.politifact.com/texas/statements/2016/oct/07/cocks-not-glocks/dildo-university-texas-class-could-lead-ticket-wou/","Cocks Not Glocks","'You would receive a citation for taking a dildo to class' at the University of Texas.","Dildo in University of Texas class could lead to a ticket, but would it? Uncertain","Guns,Regulation",2016-08-24
"http://data.gesis.org/claimskg/creative_work/86d9c2ba-1fe4-51b5-acd5-9e397f90f55d","http://www.politifact.com/oregon/statements/2012/apr/27/charlie-hales/did-charlie-hales-help-negotiate-one-time-deal-por/","Charlie Hales","Says 'I worked with our Mayor and other commissioners to help save the school year when a budget crisis in Salem threatened to cut four weeks of the school year,' including  negotiating with teachers to work for free.","Did Charlie Hales help negotiate a one-time deal with Portland teachers that saved the school year?","City Government,Voting Record,Message Machine 2012",2012-03-28
"http://data.gesis.org/claimskg/creative_work/044195ed-97ac-5696-9ecf-a3b972350954","http://www.politifact.com/texas/statements/2011/jun/02/texas-house-democratic-caucus/house-democrats-say-neighborhood-schools-are-closi/","Texas House Democratic Caucus","'Some neighborhood schools are closing.'","House Democrats say neighborhood schools are closing because of budget cuts","State Budget",2011-05-18
"http://data.gesis.org/claimskg/creative_work/914be2a2-94c5-5dd2-8a18-234ce6593713","http://www.politifact.com/texas/statements/2018/feb/23/dan-patrick/dan-patricks-2017-teacher-pay-proposal-didnt-make-/","Dan Patrick","'Last year, I proposed directing more of the education budget to teacher salaries, a move that would have resulted in an average $10,000 raise for teachers.'","Dan Patrick says he proposed directing education budget to drive up teacher salaries $10,000","State Budget",2018-01-16
"http://data.gesis.org/claimskg/creative_work/74698491-b5a2-5075-804d-91acd090f8e3","http://www.politifact.com/georgia/statements/2014/dec/19/everytown-gun-safety/deeper-look-claim-georgia-leads-nation-school-shoo/","Everytown for Gun Safety","Georgia has had 12 school shootings in the two years since the mass killing at Sandy Hook Elementary School, more than any other state.","A deeper look at claim Georgia leads the nation in school shootings since Sandy Hook","Children,Guns,Public Safety",2014-12-10
"http://data.gesis.org/claimskg/creative_work/33d0cdb0-da37-57e1-96c5-e47ae207d464","http://www.politifact.com/virginia/statements/2010/oct/28/rick-boucher/morgan-griffith-says-rick-boucher-sent-education-m/","Rick Boucher","'Morgan Griffith fought for a plan that would have taken money away from our schools and given it to Northern Virginia schools instead.'","Rick Boucher says Morgan Griffith fought to send education money from Southwest Virginia to Northern Virginia","State Budget",2010-10-25
"http://data.gesis.org/claimskg/creative_work/b46186ae-5491-5bfd-a6c9-24bb977057f8","http://www.politifact.com/north-carolina/statements/2018/may/16/stokes-county-school-teacher/nc-teacher-i-make-53-day-records-show-hes-wrong/","Stokes County school teacher","'I am roughly being paid $53 a day to educate your child.'","NC teacher: I make $53 per day. Records show he's wrong.","State Budget",2018-05-10
