"claim","review_url","claimer","text","headline","keywords","claim_date"
"http://data.gesis.org/claimskg/creative_work/828d7edf-35aa-545d-bbae-d4d218b2fe0e","http://www.politifact.com/facebook-fact-checks/statements/2019/apr/02/blog-posting/no-american-middle-schools-not-caught-forcing-stud/","Bloggers","'American middle schools caught forcing students to do Muslim prayers 5 times a day.'","No, American middle schools not 'caught forcing students to do Muslim prayers 5 times a day'","Religion,Fake news",2019-03-20
"http://data.gesis.org/claimskg/creative_work/7e2cb24c-35bb-520a-9232-4627a89b6116","http://www.politifact.com/global-news/statements/2016/jul/14/snapchat/snapchat-highlights-decades-old-data-part-michelle/","Snapchat","'90% of rural women and 55% of all women are illiterate' in Morocco.","Snapchat highlights decades old data as part of Michelle Obama visit to Morocco","Women",2016-06-30
"http://data.gesis.org/claimskg/creative_work/98bec5b8-b632-5b8c-8cb8-7f4cdad029b9","http://www.politifact.com/ohio/statements/2010/nov/30/john-kasich/gov-elect-john-kasich-says-ohios-classroom-educati/","John Kasich","'Ohio ranks 46th in the country in putting dollars in the classroom.'","Gov.-elect John Kasich says Ohio's in-classroom education spending doesn't make the grade","Government Efficiency",2010-11-03
"http://data.gesis.org/claimskg/creative_work/d0ca7046-aa5d-57dc-bbe5-2dc049c349ec","http://www.politifact.com/rhode-island/statements/2012/apr/08/jeffrey-hernandez/consultant-says-his-efforts-improved-performance-a/","Jeffrey Hernandez","Says his reform efforts improved performance at all 10 low-performing schools in Palm Beach, Florida.","Consultant says his efforts improved performance at all 10 low-performing schools in Palm Beach, Florida","Florida,City Budget",2012-03-23
"http://data.gesis.org/claimskg/creative_work/e15dd97f-b06d-5250-915c-8c3aaf6c2d0b","http://www.politifact.com/truth-o-meter/statements/2013/mar/01/arne-duncan/arne-duncan-says-teachers-are-losing-jobs-because-/","Arne Duncan","'There are literally teachers now who are getting pink slips' because of sequestration.","Arne Duncan says teachers are losing jobs because of sequestration","Federal Budget",2013-02-24
"http://data.gesis.org/claimskg/creative_work/1bd1a259-f895-5922-b096-d1ac8e524aad","http://www.politifact.com/virginia/statements/2011/may/20/ken-cuccinelli/cuccinelli-says-doe-officials-never-visited-virgin/","Ken Cuccinelli","Department of Education officials investigating Virginia Tech shootings 'have not once gotten into the car and driven down to Blacksburg to talk to the police chief or the university president or to anyone else.'","Cuccinelli says DOE officials never visited Virginia Tech while investigating shootings","Crime",2011-04-27
"http://data.gesis.org/claimskg/creative_work/8cf18a94-739b-570c-aed7-2976971202b7","http://www.politifact.com/rhode-island/statements/2013/sep/29/deadspin/deadspin-says-uri-basketball-coach-highest-paid-ri/","Deadspin","The highest paid employee of the State of Rhode Island is a basketball coach.","Deadspin says URI basketball coach is highest paid R.I. state employee","Sports,State Budget",2013-08-13
"http://data.gesis.org/claimskg/creative_work/2d0e53c3-47b7-547d-a20f-ee3d537a2b94","http://www.politifact.com/illinois/statements/2019/oct/11/lori-lightfoot/are-chicago-public-school-teachers-among-nations-h/","Lori Lightfoot","'Teachers in Chicago Public Schools are paid some of the highest compensation of any school system in the country.'","Are Chicago Public School teachers among the nation’s highest paid?","Income",2019-09-25
"http://data.gesis.org/claimskg/creative_work/e5f56edd-9560-561f-b590-949792777255","http://www.politifact.com/florida/statements/2018/may/10/adam-putnam/how-much-do-welders-and-pipefitters-make-according/","Adam Putnam","'Welders are coming out of their tech schools at $28 an hour' and 'pipefitters are making six figures.'","How much money do welders, pipefitters make? Adam Putnam says it’s huge","Income,Jobs",2018-05-05
"http://data.gesis.org/claimskg/creative_work/df2d9fb6-f216-5067-aa30-38514e020dfd","http://www.politifact.com/wisconsin/statements/2015/feb/06/scott-walker/despite-deliberate-actions-scott-walker-calls-chan/","Scott Walker","Fundamental changes made to the language describing the Wisconsin Idea in the University of Wisconsin System's mission statement were the result of a 'drafting error.'","Despite deliberate actions, Scott Walker calls change to university mission a """"drafting error""""","Government Efficiency,Public Service,State Budget",2015-02-04
"http://data.gesis.org/claimskg/creative_work/03c98a99-5aaf-52f3-896b-5af02c2d94b6","http://www.politifact.com/oregon/statements/2012/oct/13/carl-hosticka/did-julie-parrish-vote-send-160-million-private-pr/","Carl Hosticka","Says Julie Parrish 'voted to divert $160 million from public schools to private for-profit schools.'","Did Julie Parrish vote to send $160 million to private for-profit schools?","Voting Record",2012-09-05
"http://data.gesis.org/claimskg/creative_work/a7111c56-a240-519c-afa5-9282bc003033","http://www.politifact.com/texas/statements/2013/aug/08/ramey-ko/prospective-house-candidate-says-austin-school-dis/","Ramey Ko","Says some Austin school district classrooms lack electrical outlets.","Prospective House candidate says Austin school district has classrooms lacking electrical outlets","Technology",2013-07-25
"http://data.gesis.org/claimskg/creative_work/55b72608-00a7-5828-b3dd-165f575d2d64","http://www.politifact.com/texas/statements/2010/apr/21/democratic-national-committee/texas-organizer-democratic-group-says-student-lend/","Democratic National Committee","'The Health Care and Education Reconciliation Act is the largest-ever investment in higher education.'","Texas organizer for Democratic group says student-lending law is largest-ever investment in higher education","Federal Budget",2010-04-07
"http://data.gesis.org/claimskg/creative_work/67b9011c-4337-560a-b272-dd3f819ce92b","http://www.politifact.com/texas/statements/2014/dec/10/texas-right-life/texas-right-life-says-ut-students-signed-petition-/","Texas Right to Life","University of Texas students 'signed a petition seeking the legal right to abort newborn babies up to five-years-old.'","Texas Right to Life says UT students signed petition to abort babies, children up to age 5","Crime,Criminal Justice,Abortion",2014-12-05
"http://data.gesis.org/claimskg/creative_work/cbf0b600-d24e-5637-85aa-9baec02c9d3d","http://www.politifact.com/new-hampshire/statements/2016/nov/05/maggie-hassan/maggie-hassan-says-kelly-ayotte-voted-cut-90-billi/","Maggie Hassan","Kelly Ayotte 'voted for a budget that had $90 billion of cuts to Pell Grants.'","Maggie Hassan says Kelly Ayotte voted to cut $90 billion from Pell Grants","Voting Record",2016-11-02
"http://data.gesis.org/claimskg/creative_work/96db4059-a3f1-5b48-b3b2-33dc56781907","http://www.politifact.com/wisconsin/statements/2012/feb/19/kathleen-falk/recall-candidate-kathleen-falk-says-governor-scott/","Kathleen Falk","Says Scott Walker enacted 'the biggest cuts to education in our state’s history.'","Recall candidate Kathleen Falk says Governor Scott Walker enacted """"the biggest cuts to education in our state's history""""","State Finances,State Budget",2012-02-08
"http://data.gesis.org/claimskg/creative_work/26c42b2e-b06a-53ab-8bf5-6191b08fc7a4","http://www.politifact.com/texas/statements/2010/may/02/jerry-patterson/land-commissioner-says-state-getting-most-ever-oil/","Jerry Patterson","“We’re making more than ever off oil and gas right now, but it’s no secret that oil production in Texas peaked in the 1970s.”","Land commissioner says state getting most ever in oil and gas proceeds though oil production topped out in 1970s","Children,Energy",2010-04-27
"http://data.gesis.org/claimskg/creative_work/52587a5c-e203-5395-a4b3-734aa64503e0","http://www.politifact.com/virginia/statements/2016/jan/11/terry-mcauliffe/mcauliffes-claim-record-school-budget-dubious/","Terry McAuliffe","'We are taking Virginia’s investment in public education to the highest level in the commonwealth’s history.'","McAuliffe's claim of record school budget is dubious","State Budget",2015-12-17
"http://data.gesis.org/claimskg/creative_work/4ec93923-bf90-5deb-bb9b-f08d62daadd1","http://www.politifact.com/georgia/statements/2012/aug/08/fran-millar/did-lawmaker-get-good-grade-education-claim/","Fran Millar","'We have reduced funding for education the least. They've suffered the least cuts.'","Did lawmaker get a good grade on education claim?","State Budget",2012-07-25
"http://data.gesis.org/claimskg/creative_work/9bd0eb10-20bb-5b46-8c40-45341620747a","http://www.politifact.com/ohio/statements/2011/may/30/john-kasich/gov-john-kasich-says-ohio-near-bottom-classroom-sp/","John Kasich","'We are in the bottom 10 in dollars in the classroom and the top 10 in dollars in the bureaucracy and red tape.'","Gov. John Kasich says Ohio near bottom in classroom spending, but near top in administrative costs","Government Efficiency",2011-05-12
"http://data.gesis.org/claimskg/creative_work/60c015a0-f71c-504c-bcc0-ec152eabb0ad","http://www.politifact.com/north-carolina/statements/2016/sep/02/roy-cooper/roy-cooper-falsely-says-north-carolina-teacher-pay/","Roy Cooper","'Under Pat McCrory, (North Carolina) has fallen to 41st in teacher pay.'","Roy Cooper falsely says North Carolina teacher pay ranking has fallen under Pat McCrory","States,State Budget,Candidate Biography",2016-08-29
"http://data.gesis.org/claimskg/creative_work/319d074d-9d96-5852-85a9-9ff95516e834","http://www.politifact.com/global-news/statements/2016/jul/25/unicef/unicef-more-girls-south-sudan-die-childbirth-gradu/","UN's UNICEF","In South Sudan, 'more teenage girls die in childbirth than finish high school.'","UNICEF: More girls in South Sudan die in childbirth than graduate from high school","Foreign Policy,Women,Poverty",2016-07-06
"http://data.gesis.org/claimskg/creative_work/07d244a2-9454-5ab4-b627-36ca014d5349","http://www.politifact.com/florida/statements/2013/oct/27/pam-stewart/state-education-chief-says-theres-no-additional-co/","Pam Stewart","For the state of Florida, 'there is not an additional cost with implementation of the Common Core standards.'","State education chief says there's no additional costs for implementing Common Core education standards","State Budget",2013-10-15
"http://data.gesis.org/claimskg/creative_work/753f367b-58ec-5dad-b050-759fdff1e370","http://www.politifact.com/truth-o-meter/statements/2015/mar/03/hillary-clinton/hillary-clinton-says-women-earned-twice-many-compu/","Hillary Clinton","'You had more women getting computer sciences degrees in the '80s by a factor of 2-plus than you do now.'","Hillary Clinton says women earned twice as many computer science degrees in the 1980s as today","Women,Technology",2015-02-24
"http://data.gesis.org/claimskg/creative_work/f9558c74-88bd-56c8-ba0c-0f53fe8003eb","http://www.politifact.com/new-jersey/statements/2013/oct/10/steve-lonegan/steve-lonegan-claims-violent-crime-newark-also-cit/","Steve Lonegan","'Violent crime is up since the last year of Sharpe James’ administration. This year it’s higher. … The unemployment rate is almost 15 percent. The high school dropout rate is over 50 percent.'","Steve Lonegan claims violent crime is up in Newark; also pans city's unemployment, high school dropout rates","Crime,Jobs",2013-09-23
"http://data.gesis.org/claimskg/creative_work/d05b4ed2-2872-57fc-8a23-02a59ac84c1e","http://www.politifact.com/texas/statements/2011/mar/11/dan-patrick/dan-patrick-says-texas-school-districts-all-told-a/","Dan Patrick","Says Texas school districts are the fifth largest employers in the world.","Dan Patrick says Texas school districts, all told, are the world's fifth-largest employers","Workers,Corporations,Small Business",2011-02-25
"http://data.gesis.org/claimskg/creative_work/faa59ca4-f5c0-591d-9ad2-01bb010addcc","http://www.politifact.com/wisconsin/statements/2011/nov/23/rebecca-kleefisch/rebecca-kleefisch-says-recall-election-would-cost-/","Rebecca Kleefisch","A recall election for Wisconsin governor would cost '$7.7 million -- $7.7 million that may already be allocated to merit raises for teachers or health care for the poor or school books for your kids.'","Rebecca Kleefisch says recall election would cost $7.7 million that could already be allocated to teacher raises, health care for poor","Elections,State Budget",2011-11-15
"http://data.gesis.org/claimskg/creative_work/c7fb4791-1a44-5bc3-9328-837147ab1439","http://www.politifact.com/rhode-island/statements/2013/mar/24/larry-valencia/larry-valencia-says-third-s/","Larry Valencia","'Do you know that, statistically, when you take the SAT a second time, one third of the people that take the SAT, even if they've been studying, will get a lower score than they did the first time around?'","R.I. Rep. Larry Valencia says a third of students who take SAT for second time do worse than first time","Children",2013-03-19
"http://data.gesis.org/claimskg/creative_work/4384f551-8324-5813-b9e2-7df46131aeef","http://www.politifact.com/georgia/statements/2014/jan/22/nathan-deal/deals-speech-jumps-gun-education-spending-increase/","Nathan Deal","'During my administration, funding for education has increased by over $930 million.'","Deal's speech jumps the gun on education spending increase","State Budget",2014-01-15
"http://data.gesis.org/claimskg/creative_work/a22caba1-6395-5ef1-bc0b-097df9fd74f0","http://www.politifact.com/wisconsin/statements/2015/may/05/ben-carson/more-black-men-criminal-justice-system-college-pre/","Ben Carson","'There are more young black males involved in the criminal justice system than there are in higher education.'","More young black men in criminal justice system than college, presidential hopeful Ben Carson says","Census,Criminal Justice",2015-04-22
"http://data.gesis.org/claimskg/creative_work/2a7ec41b-c8ce-530d-843d-df899b1b3865","http://www.politifact.com/punditfact/statements/2013/dec/16/bob-schieffer/bob-schieffer-says-iran-president-hassan-rouhani-h/","Bob Schieffer","Iran President Hassan 'Rouhani has more Cabinet members with Ph.D.s from American universities' than members of Barack Obama’s Cabinet.","Bob Schieffer says Iran President Hassan Rouhani has more cabinet members with American Ph.D.s than Obama","Foreign Policy",2013-12-09
"http://data.gesis.org/claimskg/creative_work/6624794c-895c-56bc-9d21-40585ccbaedc","http://www.politifact.com/truth-o-meter/statements/2013/aug/27/moms-demand-action-gun-sense-america/moms-demand-action-says-little-red-riding-hood-has/","Moms Demand Action for Gun Sense In America","The book Little Red Riding Hood is something 'that’s been banned in America,' but not assault weapons.","Moms Demand Action says 'Little Red Riding Hood' has been banned, but assault weapons haven't","Guns",2013-04-15
"http://data.gesis.org/claimskg/creative_work/4ae3b160-54fb-51fd-baf1-3c9679f24240","http://www.politifact.com/florida/statements/2010/sep/16/national-republican-congressional-committee/allen-boyd-cost-sallie-mae-employees-their-jobs-he/","National Republican Congressional Committee","'700 jobs (were) lost because Allen Boyd' voted for the health care bill.","Allen Boyd cost Sallie Mae employees their jobs with health care vote, Republicans claim","Message Machine 2010,Elections",2010-09-12
"http://data.gesis.org/claimskg/creative_work/2b35406a-41fa-5393-bcc0-8e3fe52bd266","http://www.politifact.com/oregon/statements/2013/sep/03/earl-blumenauer/has-portland-won-more-national-Constitution-contes/","Earl Blumenauer","'The city of Portland has won more national Constitution contests than any city in America.'","Has Portland won more national Constitution contests than any other city?","Debates",2013-08-23
"http://data.gesis.org/claimskg/creative_work/1f1a1b6f-202f-59c6-8bce-cfa3bfde4fee","http://www.politifact.com/tennessee/statements/2012/feb/19/chris-thomas/suburban-advocates-say-shelby-county-gave-memphis-/","Chris Thomas","'Shelby County donated – I’m sorry, gave – 44 schools to the city of Memphis.'","Suburban advocates say Shelby County 'gave' Memphis 44 schools in annexations","Infrastructure",2012-02-06
"http://data.gesis.org/claimskg/creative_work/49529b26-053d-5223-b909-1f663639fac2","http://www.politifact.com/wisconsin/statements/2015/feb/20/rebecca-blank/scott-walkers-300-million-budget-cut-looming-uw-ma/","Rebecca Blank","UW-Madison 'spent down reserves' as it was told to do two years ago and, facing new state budget cuts, has 'no more reserves to spend down.'","With Scott Walker's $300 million budget cut looming, UW-Madison says it doesn't have reserves to tap","State Finances,State Budget",2015-02-12
"http://data.gesis.org/claimskg/creative_work/778fd20b-f0c7-5a22-990a-8e5856c10944","http://www.politifact.com/florida/statements/2013/may/06/allison-tant/democratic-party-chair-allison-tant-attacks-gov-ri/","Allison Tant","Says Gov. Rick Scott allowed Republican legislators to cut his teacher pay raise proposal by 60 percent.","Democratic Party chair Allison Tant attacks Gov. Rick Scott on teacher pay raises","State Budget",2013-04-30
"http://data.gesis.org/claimskg/creative_work/e71e1230-3354-5186-8a64-204b6788a2f1","http://www.politifact.com/wisconsin/statements/2018/may/30/scott-walker/caveats-scott-walker-right-income-and-property-tax/","Scott Walker","'Property and income taxes will be lower in 2018 than they were in 2010.'","With caveats, Scott Walker is right that income and property taxes in 2018 are lower than in 2010","Income,State Finances,State Budget",2018-04-17
"http://data.gesis.org/claimskg/creative_work/0d92860a-737e-51b6-9cf7-5874ce98261a","http://www.politifact.com/wisconsin/statements/2013/may/08/kevin-reilly/uw-systems-reserves-fair-middling-system-president/","Kevin Reilly","University of Wisconsin System's reserves are in the 'mid- to low-range' of comparable university systems.","UW System's reserves fair to middling, system president says","State Finances,States,State Budget",2013-04-23
"http://data.gesis.org/claimskg/creative_work/9cfbc795-26b8-578b-a401-4646dfe44e6d","http://www.politifact.com/texas/statements/2018/aug/15/donna-howard/donna-howard-says-charter-schools-draw-more-studen/","Donna Howard","Says Texas charter schools 'get 100% state $/pupil funding while district schools (95% students) get about 1/3 funding from state w/ rest coming from local prop taxes (which is why those taxes are so high). Districts getting less b/c scarce $ going to charters.'","Donna Howard says charter schools draw more per-student state aid than socked school districts","State Finances,State Budget",2018-07-18
"http://data.gesis.org/claimskg/creative_work/5631ac96-7d63-5fa3-9bfe-6b2f65da1c26","http://www.politifact.com/florida/statements/2012/aug/30/rick-santorum/rick-santorum-says-obama-wants-nationalize-curricu/","Rick Santorum","President Obama’s education 'solution' includes an effort to 'nationalize curriculum.'","Rick Santorum says Barack Obama wants to """"nationalize curriculum""""","Children",2012-08-28
"http://data.gesis.org/claimskg/creative_work/fa87d2c0-d71c-57e4-859c-17cba0ec7afc","http://www.politifact.com/texas/statements/2011/sep/28/mitt-romney/mitt-romney-says-says-illegal-immigrants-get-10000/","Mitt Romney","Says that illegal immigrants get a $100,000 break on University of Texas tuition over four years.","Mitt Romney says illegal immigrants get a $100,000 break on University of Texas tuition over four years","State Finances,State Budget",2011-09-22
"http://data.gesis.org/claimskg/creative_work/613ceedc-422b-5f79-8d9d-320b96b04cbb","http://www.politifact.com/rhode-island/statements/2013/feb/17/brian-patrick-kennedy/rep-brian-patrick-kennedy-suggests-employers-and-s/","Brian Patrick Kennedy","Employers and schools have no right to conduct 'surveillance of a dorm room or a worker’s cubicle.'","Rep. Brian Patrick Kennedy suggests employers and schools are banned from monitoring workers in their cubicles and students in their dorm rooms","Privacy,Workers,Technology,Unions,Government regulation,Human Rights,Legal Issues",2013-02-06
"http://data.gesis.org/claimskg/creative_work/3e085dfe-2b7a-5098-bec3-9119344ed764","http://www.politifact.com/ohio/statements/2012/apr/10/sandra-williams/rep-sandra-williams-says-9997-percent-cleveland-pu/","Sandra Williams","'99.97 percent of the kids live in poverty that attend Cleveland public schools.'","Rep. Sandra Williams says 99.97 percent of Cleveland public schoolchildren live in poverty","Poverty",2012-03-21
"http://data.gesis.org/claimskg/creative_work/eebefa75-18ba-5ca6-b076-ad7278f72b27","http://www.politifact.com/virginia/statements/2015/jan/04/mark-warner/warner-sexual-assualt-its-safer-women-not-be-colle/","Mark Warner","Regarding sexual assault against women, 'It’s actually safer not to be in college than it is to be in college.'","Warner on sexual assault: It's safer for women not to be in college","Crime",2014-12-03
"http://data.gesis.org/claimskg/creative_work/aacfc01f-a67b-5aa0-9515-f934a1a5a86c","http://www.politifact.com/wisconsin/statements/2015/jun/09/hillary-clinton/scott-walker-limited-early-voting-made-it-harder-c/","Hillary Clinton","Says Scott Walker 'cut back early voting and signed legislation that would make it harder for college students to vote.'","Scott Walker limited early voting, made it harder for college students to vote, Hillary Clinton says","Elections,Job Accomplishments,Civil Rights,Negative Campaigning",2015-06-04
"http://data.gesis.org/claimskg/creative_work/6a67c0d5-9214-540a-a2d3-d557f0cfeb41","http://www.politifact.com/california/statements/2018/nov/05/tony-thurmond/ad-wrongly-implies-marshall-tuck-backed-betsy-devo/","Tony Thurmond","Says Marshall Tuck 'is backed by Donald Trump’s education advisor' pictured as Betsy DeVos.","Ad wrongly implies Marshall Tuck is ‘backed’ by Betsy DeVos","Elections",2018-10-11
"http://data.gesis.org/claimskg/creative_work/31a8439f-5a7d-5229-9dc5-357f3d6ae29b","http://www.politifact.com/texas/statements/2018/feb/16/scott-milder/scott-milder-state-share-education-spending-68-38-/","Scott Milder","'In the 1980s, the state funded 68% of school expenses, and now the state’s share is 38%.'","Scott Milder: State share of education spending was 68 percent in 1980s--now it's down to 38 percent","Children,State Budget",2018-02-06
"http://data.gesis.org/claimskg/creative_work/274cb3a8-4339-5981-9b6a-23a40e9f5fb1","http://www.politifact.com/texas/statements/2012/jan/21/silvestre-reyes/silvestre-reyes-says-says-282-texas-school-distric/","Silvestre Reyes","Says 282 Texas school districts have requested emergency waivers to increase elementary school class sizes because of 'unprecedented fiscal challenges.'","Silvestre Reyes says says 282 Texas school districts requested class-size waivers because of 'unprecedented fiscal challenges'","State Finances,State Budget",2012-01-09
"http://data.gesis.org/claimskg/creative_work/3bfd76f6-9729-5f92-ae9c-93dd4a4f44e8","http://www.politifact.com/global-news/statements/2016/mar/17/gayle-smith/usaid-head-overshoots-gains-getting-more-kids-scho/","Gayle Smith","As a sign of 'extraordinary progress,' 'there are half as many (primary-age) children out of school today as there were 15 years ago.'","USAID head overshoots gains on getting more kids into school","Foreign Policy",2016-03-09
"http://data.gesis.org/claimskg/creative_work/588d85ae-0203-548f-baaa-8e0619172531","http://www.politifact.com/facebook-fact-checks/statements/2018/dec/11/blog-posting/yes-school-principal-tried-ban-candy-canes/","Bloggers","'Principal bans candy canes.'","Yes, a school principal tried to ban candy canes","Religion,Fake news",2018-12-09
"http://data.gesis.org/claimskg/creative_work/d80bfb40-5024-5037-acd4-382c3ffc2bdb","http://www.politifact.com/tennessee/statements/2012/nov/04/stand-children-tennessee/schools-must-get-half-proceeds-county-sales-tax-in/","Stand For Children Tennessee","Says that 'Tennessee law requires that schools receive half of proceeds -- $31 million per year' -- from a half-cent increase in the Shelby County sales tax.","Schools must get half the proceeds from county sales tax increase, says Stand For Children","County Budget,County Government",2012-10-24
"http://data.gesis.org/claimskg/creative_work/767ffc9f-3d69-5f14-9c0e-d5f806d91817","http://www.politifact.com/virginia/statements/2011/jun/28/democratic-party-virginia/democrats-say-bob-mcdonnell-tried-raid-education-p/","Democratic Party of Virginia","Gov. Bob McDonnell launched a 'raid on public education to pay for roads.'","Democrats say Bob McDonnell tried to raid education to pay for roads","Transportation,State Budget",2011-06-02
"http://data.gesis.org/claimskg/creative_work/69e2bbaa-c74d-5f9a-a1b6-f7fe3df7c0f6","http://www.politifact.com/virginia/statements/2014/jun/10/mark-warner/warner-says-us-student-debt-has-surpassed-credit-c/","Mark Warner","'Right now, America has $1.1 trillion of student debt. That’s more than credit card debt.'","Warner says U.S. student debt has surpassed credit card debt","Message Machine 2014,Debt",2014-05-29
"http://data.gesis.org/claimskg/creative_work/9176d66f-1943-5df7-8bf6-a47c174c0553","http://www.politifact.com/texas/statements/2018/mar/01/ann-teich/austin-school-board-member-says-stephen-f-austin-a/","Ann Teich","Says Stephen F. Austin and James Bowie promoted slavery.","Austin school board member says Stephen F. Austin and James Bowie each promoted slavery","History",2018-02-26
