"claim","review_url","claimer","text","headline","keywords","claim_date"
"http://data.gesis.org/claimskg/creative_work/38445f4d-353d-5a17-a5f2-c635e9e82f5c","http://www.politifact.com/georgia/statements/2010/aug/02/preston-smith/olens-deserves-some-blame-immigration-ruling-oppon/","Preston Smith","'We have my opponent Sam Olens to thank for [the Arizona immigration ruling] since he was on the team that got Clinton elected.'","Olens deserves some blame for immigration ruling, opponent says","Elections",2010-07-28
"http://data.gesis.org/claimskg/creative_work/484fe267-4814-5f17-be56-1ca547732ccf","http://www.politifact.com/truth-o-meter/statements/2012/oct/17/barack-obama/barack-obama-says-says-mitt-romney-called-arizona-/","Barack Obama","Says Mitt Romney 'called the Arizona law a model for the nation.'","Barack Obama says Mitt Romney called the Arizona immigration law a 'model for the nation.'","Legal Issues",2012-10-16
"http://data.gesis.org/claimskg/creative_work/2a05d291-e63a-5a29-a446-383c2db6a521","http://www.politifact.com/texas/statements/2011/may/24/louie-gohmert/louie-gohmert-says-gov-rick-perry-begging-coast-gu/","Louie Gohmert","Says Gov. Rick Perry has been 'begging' for the federal government to send the Coast Guard to patrol two lakes on the U.S.-Mexico border.","Louie Gohmert says Gov. Rick Perry is begging for Coast Guard to patrol two border lakes","Crime",2011-05-10
"http://data.gesis.org/claimskg/creative_work/eb5a323d-98ce-5f4d-97ff-887cc831ce92","http://www.politifact.com/truth-o-meter/statements/2016/jun/13/donald-trump/donald-trump-correct-us-gives-100000-green-cards-y/","Donald Trump","'We admit more than 100,000 lifetime migrants from the Middle East each year.'","Donald Trump correct that U.S. gives 100,000 green cards a year to migrants from Middle East","Foreign Policy",2016-06-12
"http://data.gesis.org/claimskg/creative_work/6292101e-64e0-5b3c-9a8a-3829a43a5917","http://www.politifact.com/texas/statements/2010/aug/23/debbie-riddle/debbie-riddle-says-more-81-babies-born-houston-hos/","Debbie Riddle","'Over 81 percent of the babies that are born at LBJ Hospital right here in Houston are born of women who are not here legally.'","Debbie Riddle says more than 81% of babies born at Houston hospital have moms here illegally","Children,Families,Terrorism",2010-08-10
"http://data.gesis.org/claimskg/creative_work/411c245a-8f98-540c-a303-8e06b2bcdc23","http://www.politifact.com/facebook-fact-checks/statements/2019/jun/17/brian-kolfage/no-new-mexico-does-not-give-ebt-cards-immigrants-h/","Brian Kolfage","Says that in New Mexico, 'illegals are issued emergency welfare EBT cards with $1k a month +$200 for each child, for at least 5+ years until they see a judge.'","No, New Mexico does not give EBT cards to immigrants in U.S. illegally as they wait to see a judge","Homeland Security,Welfare",2019-06-10
"http://data.gesis.org/claimskg/creative_work/65fd681f-4ae9-58e8-8d9b-2ca9f1603cd9","http://www.politifact.com/truth-o-meter/statements/2017/sep/26/tom-cotton/sen-tom-cotton-misleads-claim-about-dream-act-amne/","Tom Cotton","'If you pass the so-called Dream Act, it will be the single biggest amnesty in the history of the United States, even bigger than the 1986 amnesty.'","Sen. Tom Cotton misleads in claim about Dream Act amnesty","Homeland Security",2017-09-17
"http://data.gesis.org/claimskg/creative_work/0ba35546-1984-5eb6-bb1a-5f33456984bb","http://www.politifact.com/truth-o-meter/statements/2010/may/03/janet-napolitano/facts-illegal-immigrants-show-nuances-enforcement-/","Janet Napolitano","Numbers on illegal immigrants 'are down in terms of apprehensions, which indicates fewer illegal crossings, but also up in terms of actual enforcement actions.'","Facts on illegal immigrants show nuances of """"enforcement actions""""","Homeland Security,This Week - ABC News",2010-05-02
"http://data.gesis.org/claimskg/creative_work/33299ca3-3826-5191-92ab-a2883787adba","http://www.politifact.com/california/statements/2018/jan/29/steve-cortes/are-55-percent-immigrants-california-welfare-s-exa/","Steve Cortes","'We have right now, … in the state of California, 55 percent of all immigrants are on public assistance.'","Are 55 percent of immigrants in California on welfare? That's an exaggeration","Welfare",2018-01-23
"http://data.gesis.org/claimskg/creative_work/1858f411-872f-5380-9bb7-4d4c6def8b62","http://www.politifact.com/florida/statements/2016/apr/04/ron-desantis/terrorists-groups-besides-isis-crossing-us-mexico-/","Ron DeSantis","'Recent reports state that the U.S. Customs and Border Protection has apprehended several members of known Islamist terrorist organizations crossing the southern border in recent years.'","Terrorists from groups besides ISIS crossing U.S.-Mexico border, U.S. Rep. Ron DeSantis says","Homeland Security,Terrorism",2016-03-23
"http://data.gesis.org/claimskg/creative_work/73f149c9-f71c-578c-8c03-6f241e8fd36f","http://www.politifact.com/punditfact/statements/2018/jun/18/yournewswirecom/false-headline-wrongly-links-hillary-clinton-forme/","YourNewsWire.com","'Senate report admits Clinton ‘gifted’ children to human traffickers'","False headline wrongly links Hillary Clinton to former government shortcomings on immigration","Children,Fake news",2018-06-17
"http://data.gesis.org/claimskg/creative_work/de42dc31-d17c-5d93-a87d-c14aa7e817c6","http://www.politifact.com/truth-o-meter/statements/2010/apr/28/alfredo-gutierrez/arizona-immigration-law-allows-police-question-any/","Alfredo Gutierrez","The new Arizona immigration law 'says that any police officer can stop anyone who appears to them to be reasonably suspicious of being an undocumented person.'","Arizona immigration law allows police to question 'anyone' who's 'reasonably suspicious' of being illegal","Legal Issues",2010-04-26
"http://data.gesis.org/claimskg/creative_work/5ee48104-500d-518f-81e6-971a66104323","http://www.politifact.com/punditfact/statements/2018/jul/05/viral-image/phony-image-alleged-maxine-waters-called-undocumen/","Viral image","Says Maxine Waters told CNN, 'SCOTUS pick should be illegal immigrant.'","Phony image said Maxine Waters called for undocumented immigrant as SCOTUS nominee","Supreme Court,Fake news",2018-06-28
"http://data.gesis.org/claimskg/creative_work/bec35fd0-87f1-51b0-802c-986dfd08fcef","http://www.politifact.com/truth-o-meter/statements/2016/oct/20/donald-trump/donald-trump-says-hillary-clinton-fought-wall-betw/","Donald Trump","Says Hillary Clinton 'wanted the wall.'","Donald Trump says Hillary Clinton fought for a wall between U.S., Mexico","Homeland Security,Voting Record,History,Candidate Biography",2016-10-19
"http://data.gesis.org/claimskg/creative_work/befc981f-4076-517d-947a-f6290ec41ea3","http://www.politifact.com/facebook-fact-checks/statements/2018/nov/29/blog-posting/no-photo-migrant-mother-and-her-children-running-t/","Bloggers","Photo of migrant mother at U.S.-Mexico border running from tear gas with children 'was a staged hoax.'","No, the photo of the migrant mother running from tear gas with her children was not staged","Fake news",2018-11-26
"http://data.gesis.org/claimskg/creative_work/9b260259-236c-5d20-87cb-fe624d604a72","http://www.politifact.com/ohio/statements/2018/mar/23/onward-ohio/ohio-tv-ad-misleads-attack-mike-dewine-about-immig/","Onward Ohio","'In the Senate, (Mike) DeWine voted with Hillary Clinton to let illegal immigrants receive Social Security. And in Ohio, DeWine allowed illegal immigrants to receive driver's licenses.'","Ohio TV ad misleads in attack on Mike DeWine about immigration","Social Security",2018-03-20
"http://data.gesis.org/claimskg/creative_work/83b7a00b-90d0-5905-89bd-204d04352e1b","http://www.politifact.com/texas/statements/2014/jun/10/lamar-smith/lamar-smith-claim-about-obamas-prison-break-illega/","Lamar Smith","'Last year,' Obama 'administration officials released into our neighborhoods more than 36,000 criminal immigrants who had nearly 88,000 convictions. The crimes included hundreds of convictions for murder, rape and kidnapping and thousands of drug-related crimes.'","Lamar Smith claim about Obama's 'prison break' of illegal immigrants fails to acknowledge detainees had served criminal sentences and all releases weren't discretionary","Crime,Criminal Justice",2014-05-31
"http://data.gesis.org/claimskg/creative_work/2e9ac78d-441c-50ab-adae-5c314bedbc83","http://www.politifact.com/facebook-fact-checks/statements/2019/apr/26/viral-image/migrant-infants-have-appeared-defendants-immigrati/","Viral image","For the first time in U.S. history, a one-year-old appears in court as a defendant.","Migrant infants have appeared as defendants in immigration court for years, despite viral claim","Children,Legal Issues",2019-04-10
"http://data.gesis.org/claimskg/creative_work/3b7e5310-ee26-591e-9deb-34decbbdd0cf","http://www.politifact.com/california/statements/2018/jul/03/donald-trump/pants-fire-white-house-claim-sen-harris-supporting/","Donald Trump","Sen. Kamala Harris is 'supporting the animals of MS-13.'","Pants On Fire: White House claim Sen. Kamala Harris ‘supporting MS-13’","Crime",2018-07-02
"http://data.gesis.org/claimskg/creative_work/52296d48-5145-5345-b4cc-e7a977b8e1bb","http://www.politifact.com/truth-o-meter/statements/2010/jul/06/jorge-ramos/obama-deported-more-people-his-first-year-bush-did/","Jorge Ramos","'President Barack Obama has deported more people in his first year in office than George W. Bush in his last year in office.'","Obama deported more people in his first year than Bush did in his last, Spanish-language news anchor says","This Week - ABC News,Legal Issues",2010-07-04
"http://data.gesis.org/claimskg/creative_work/d97ef2c6-ed18-5d99-9008-48d6c3c35965","http://factscan.ca/kellie-leitch-detain-question-and-return/","Kellie Leitch","Stopping “illegal” immigration is as simple as detain, question, and return","Kellie Leitch: “Detain, question, and return - it's that simple.” - FactsCanada","CPC",2017-04-14
"http://data.gesis.org/claimskg/creative_work/de21e0ef-dc2d-5c33-9e60-415ca5bcc4a5","http://www.politifact.com/wisconsin/statements/2016/mar/11/ron-johnson/how-much-authority-does-barack-obama-have-allowing/","Ron Johnson","Says Barack Obama 'has the legal authority to let in really however many refugees he wants, from whatever country.'","How much authority does Barack Obama have in allowing refugees to come to the U.S.?","Federal Budget,Foreign Policy,Terrorism",2016-02-05
"http://data.gesis.org/claimskg/creative_work/a998a298-fed7-50d6-9a63-9e38af31f8d2","http://www.politifact.com/texas/statements/2010/nov/01/bill-white/bill-white-says-under-rick-perry-state-troopers-ha/","Bill White","Says that under Gov. Rick Perry, Texas Department of Public Safety troopers have had 'standing orders' not to inquire into the immigration status of people unless they're under arrest.","Bill White says that under Rick Perry, state troopers have been under standing orders not to ask anyone's immigration status unless they're under arrest","Public Safety",2010-10-15
"http://data.gesis.org/claimskg/creative_work/bb015f53-d3a3-588c-9090-6ee787e63d26","http://www.politifact.com/truth-o-meter/statements/2016/may/08/donald-trump/donald-trump-wrongly-says-noncitizens-can-vote-whe/","Donald Trump","'You have to be a citizen to vote,' but with same-day voter registration, 'you have places where people just walk in and vote.'","Donald Trump wrongly says noncitizens can vote when there is same-day voter registration","Elections",2016-05-08
"http://data.gesis.org/claimskg/creative_work/88acb9cf-68ae-5405-b4b7-0bf98d3e0b2c","http://www.politifact.com/punditfact/statements/2017/jul/24/blog-posting/13-million-crops-rotted-calif-because-no-one-wante/","Bloggers","'Over $13 million worth of crops have ROTTED in California, all because no one is willing to work jobs vacated by migrants.'","$13 million in crops rotted in Calif. because no one wanted to pick them?","Agriculture,Food",2017-06-28
"http://data.gesis.org/claimskg/creative_work/1b59679f-a51d-5e4e-aaef-a9f9b5dada0c","http://www.politifact.com/truth-o-meter/statements/2018/feb/07/donald-trump/immigration-ms-13-and-crime-facts-behind-donald-tr/","Donald Trump","Many gang members have taken advantage of 'glaring loopholes and our laws to enter the country as illegal, unaccompanied, alien minors.'","Immigration, MS-13 and crime: the facts behind Donald Trump’s exaggerations","Homeland Security,Crime",2018-01-30
"http://data.gesis.org/claimskg/creative_work/8aa8daed-340a-56d6-b019-395e0a3db6f2","http://www.politifact.com/illinois/statements/2019/jul/28/richard-durbin/has-trump-encouraged-unprecedented-number-migrants/","Richard Durbin","Says President Trump 'has ended up attracting larger numbers of people coming to the United States presenting themselves for asylum status at our border than we’ve ever seen.'","Has Trump encouraged an unprecedented number of migrants to seek asylum at the border?","Corrections and Updates",2019-07-11
"http://data.gesis.org/claimskg/creative_work/592c50f2-d905-50d4-833d-e57378b2f848","http://www.politifact.com/punditfact/statements/2019/jul/15/rush-limbaugh/limbaugh-wrongly-blames-obama-no-census-citizenshi/","Rush Limbaugh","'Somebody in the Obama regime decided to get rid of' the citizenship question in the census.","Limbaugh wrongly blames Obama for no census citizenship question","Census",2019-07-12
"http://data.gesis.org/claimskg/creative_work/58cc9997-23d7-5a00-b966-dc4113f66b6f","http://www.politifact.com/truth-o-meter/statements/2014/aug/03/rick-perry/rick-perry-historic-record-highs-people-terrorists/","Rick Perry","The United States is at 'historic record highs' of individuals being apprehended on the border from countries with terrorist ties such as 'Pakistan or Afghanistan or Syria.'","Rick Perry: 'Historic record highs' of people from terrorists states being apprehended at border","Terrorism,Afghanistan",2014-08-03
"http://data.gesis.org/claimskg/creative_work/c9de5eec-3b08-5c33-8c8b-749e142780d1","http://www.politifact.com/facebook-fact-checks/statements/2019/jan/15/viral-image/did-lettuce-kill-more-americans-undocumented-immig/","Viral image","'Lettuce killed more Americans this year than undocumented immigrants.'","Did lettuce kill more Americans than undocumented immigrants?","Food,Crime,Food Safety",2019-01-10
"http://data.gesis.org/claimskg/creative_work/436935cf-8a68-595f-a069-d4b1139ed727","http://www.politifact.com/truth-o-meter/statements/2010/oct/29/sharron-angle/sharron-angle-says-se-harry-reid-twice-voted-again/","Sharron Angle","Sen. Harry Reid voted 'against declaring English our national language, twice.'","Sharron Angle says Sen. Harry Reid twice voted against making English the national language","Message Machine 2010",2010-10-25
"http://data.gesis.org/claimskg/creative_work/a3300fa0-92ef-54e4-83aa-03332648d2aa","http://www.politifact.com/truth-o-meter/statements/2018/sep/13/jeff-merkley/yes-10-million-were-transferred-fema-ice/","Jeff Merkley","Says the Trump administration transferred $10 million from FEMA to ICE.","Yes, $10 million were transferred from FEMA to ICE","Homeland Security",2018-09-11
"http://data.gesis.org/claimskg/creative_work/36e3d5ac-e066-5610-8dcd-20672c859cd0","http://www.politifact.com/california/statements/2018/sep/12/gavin-newsom/gavin-newsoms-misleading-claim-john-cox-parroting-/","Gavin Newsom","Says John Cox 'parroted, parroted Trump — almost verbatim — on the children’s separation issues at the border.'","Gavin Newsom’s misleading claim on John Cox ‘parroting’ Trump on family separations","Crime,Criminal Justice,Public Safety,The 2018 California Governor's Race",2018-08-17
"http://data.gesis.org/claimskg/creative_work/cfa7c6b4-db3a-5b43-a8f3-c973d7f45bbb","http://www.politifact.com/texas/statements/2011/may/13/jay-carney/president-obamas-press-secretary-says-rick-perry-d/","Jay Carney","Says Rick Perry 'turned down our invitation to meet' President Barack Obama in El Paso.","President Obama's press secretary says Rick Perry declined to meet president in El Paso","Bipartisanship",2011-05-10
"http://data.gesis.org/claimskg/creative_work/7f9a44bf-ee7c-554d-b49b-c200935e2a5f","http://www.politifact.com/truth-o-meter/statements/2017/sep/05/jeff-sessions/jeff-sessions-questionable-claim-daca-helped-cause/","Jeff Sessions","Says President Barack Obama’s policy known as DACA 'contributed to a surge of minors at the southern border.'","Jeff Sessions' questionable claim that DACA helped cause spike in minors at border","Diversity,Legal Issues",2017-09-05
"http://data.gesis.org/claimskg/creative_work/b078cb47-a114-5b1c-81ef-5e5c952c2aa6","http://www.politifact.com/truth-o-meter/statements/2019/feb/20/amy-klobuchar/would-2013-immigration-bill-have-saved-158-b/","Amy Klobuchar","'Comprehensive immigration reform, the bill we had back in 2013 ... brought the debt down $158 billion.'","Would the 2013 immigration bill have saved $158 billion, as Amy Klobuchar said?","Federal Budget",2019-02-18
"http://data.gesis.org/claimskg/creative_work/190039a2-ed6b-543a-a60e-2f76d6c82d83","http://www.politifact.com/truth-o-meter/statements/2016/jul/28/barack-obama/crime-and-illegal-immigration-are-decades-long-low/","Barack Obama","'Illegal immigration and the crime rate are as low as they’ve been in decades.'","Crime and illegal immigration are at decades-long lows, says Barack Obama","Crime,History",2016-07-27
"http://data.gesis.org/claimskg/creative_work/9a1f5403-fa09-550c-98bd-f958fc50aaf0","http://www.politifact.com/texas/statements/2015/apr/17/judicial-watch/judicial-watch-says-isis-has-camp-mexico-and-near-/","Judicial Watch","'ISIS camp a few miles from Texas, Mexican authorities confirm.'","Judicial Watch says ISIS operating a camp in Mexico--near El Paso","Military,Terrorism",2015-04-14
"http://data.gesis.org/claimskg/creative_work/3b816db6-ab1e-5f72-923f-5bd94e153be4","http://www.politifact.com/truth-o-meter/statements/2013/jan/31/rush-limbaugh/limbaugh-says-immigrants-come-us-seeking-prosperit/","Rush Limbaugh","Research shows that 'a vast majority of arriving immigrants today come here because they believe that government is the source of prosperity, and that's what they support.'","Rush Limbaugh says immigrants come to U.S. seeking prosperity from government","Pundits",2013-01-29
"http://data.gesis.org/claimskg/creative_work/35d93ffa-83ce-509f-bdf5-6a84de3a53c8","http://factscan.ca/andrew-scheer-canadas-sovereignty/","Andrew Scheer","Andrew Scheer: The Global Compact for Migration cedes Canada's sovereignty. - FactsCanada","Andrew Scheer: The Global Compact for Migration cedes Canada's sovereignty. - FactsCanada","Andrew Scheer,CPC",2018-12-05
"http://data.gesis.org/claimskg/creative_work/4fd00f20-196e-5008-ac4d-f64949f45426","http://www.politifact.com/truth-o-meter/statements/2017/dec/20/donald-trump/pick-them-bin-donald-trump-mischaracterizes-divers/","Donald Trump","Says of the diversity visa lottery program, 'they give us their worst people, they put them in a bin,' and 'the worst of the worst' are selected.","Pick them from a bin? Donald Trump mischaracterizes diversity visa lottery","Homeland Security",2017-12-15
"http://data.gesis.org/claimskg/creative_work/86d51682-8ebd-5541-92b4-bdf21800cf28","http://www.politifact.com/california/statements/2017/aug/03/antonio-villaraigosa/mostly-true-undocumented-immigrants-less-likely-co/","Antonio Villaraigosa","'Undocumented immigrants commit less crimes than the native born.'","MOSTLY TRUE: Undocumented immigrants less likely to commit crimes than U.S. citizens","Crime,Corrections and Updates,The 2018 California Governor's Race",2017-07-31
"http://data.gesis.org/claimskg/creative_work/bac8b202-ee05-51ea-b948-96dda142ed4c","http://www.politifact.com/truth-o-meter/statements/2012/aug/10/american-principles-action/has-barack-obama-deported-more-people-any-other-pr/","American Principles in Action","Says Barack Obama 'has deported more people than any other president in this country's history.'","Has Barack Obama deported more people than any other president in U.S. history?","Message Machine 2012",2012-08-07
"http://data.gesis.org/claimskg/creative_work/01b326ce-374c-5f1d-a2f1-7c04d961bfb5","http://factscan.ca/justin-trudeau-the-minister-of-citizenship-and-immigration-said-that-the-hijab-was-an-indefensible-perversion-of-canadian-values/","Justin Trudeau","Justin Trudeau: 'The Minister of Citizenship and Immigration said that the hijab was an indefensible perversion of Canadian values.” - FactsCanada","Justin Trudeau: """"The Minister of Citizenship and Immigration said that the hijab was an indefensible perversion of Canadian values.” - FactsCanada","Justin Trudeau,LPC",2015-03-10
"http://data.gesis.org/claimskg/creative_work/5fd75ad8-4662-5c2e-8002-e2ae498dd899","http://www.politifact.com/georgia/statements/2010/jul/16/nathan-deal/nathan-deal-says-immigration-costs-georgians-more-/","Nathan Deal","'Illegal aliens are costing Georgia taxpayers over a billion dollars every year.'","Nathan Deal says immigration costs Georgians more than $1 billion","Message Machine 2010",2010-07-06
"http://data.gesis.org/claimskg/creative_work/0ad8d006-7c68-5fc7-a0b0-648318884d9f","http://www.politifact.com/truth-o-meter/statements/2011/nov/23/michele-bachmann/michele-bachmann-says-steve-jobs-told-obama-he-mov/","Michele Bachmann","Says Apple CEO Steve Jobs told President Obama that the company moved factories to China because it needed 30,000 engineers.","Michele Bachmann says Steve Jobs told Obama he moved factories to China for engineers","Foreign Policy,Jobs,Government regulation",2011-11-22
"http://data.gesis.org/claimskg/creative_work/459f6eb6-c97b-537b-b408-78a7de370075","http://www.politifact.com/truth-o-meter/statements/2017/jan/29/donald-trump/no-evidence-trump-claim-it-was-impossible-syrian-c/","Donald Trump","'If you were a Muslim, you could come in, if you were a Christian, it was impossible.'","No evidence for Trump claim that it was 'impossible' for Syrian Christians to enter U.S.","Foreign Policy,Religion",2017-01-27
"http://data.gesis.org/claimskg/creative_work/367690e7-6f2f-52ca-95d4-29485799e803","http://www.politifact.com/truth-o-meter/statements/2013/apr/19/blog-posting/immigrants-would-get-free-cell-phones-under-new-pr/","Bloggers","Proposed immigration legislation would give new immigrants 'a taxpayer-funded cellular phone.'","Immigrants would get free cell phones under new proposal, bloggers claim","Welfare",2013-04-17
"http://data.gesis.org/claimskg/creative_work/351da897-697d-5296-9595-6d10f46d1770","http://www.politifact.com/florida/statements/2017/mar/15/florida-conference-catholic-bishops/being-united-states-unlawfully-crime/","Florida Conference of Catholic Bishops","'Unlawful presence (in the United States) is not a crime.'","Is being in the United States unlawfully a 'crime'?","Legal Issues",2017-03-15
"http://data.gesis.org/claimskg/creative_work/b9bf3219-2af3-5fc6-903d-0fee7d00e8c1","http://www.politifact.com/truth-o-meter/statements/2014/jan/13/facebook-posts/facebook-post-says-constitution-exemption-zones-ex/","Facebook posts","A judge's order means there's a 'Constitution exemption zone' if you live 'within 100 miles of the United States border.'","Facebook post says 'Constitution exemption zones' extend 100 miles from U.S. borders","Privacy,Civil Rights,Technology",2014-01-05
"http://data.gesis.org/claimskg/creative_work/c4b41b22-619c-5380-9311-b5a6f5a1b02a","http://www.politifact.com/rhode-island/statements/2010/jul/15/helen-glover/helen-glover-says-phoenix-kidnap-capital-western-h/","Helen Glover","Phoenix is the kidnapping capital 'of the Western Hemisphere.'","Helen Glover says Phoenix is kidnapping capital of Western Hemisphere","Crime",2010-07-09
"http://data.gesis.org/claimskg/creative_work/04f30364-9283-56fd-9bce-067779b321e1","http://www.politifact.com/truth-o-meter/statements/2010/aug/06/lindsey-graham/illegal-immigrants-anchor-babies-birthright/","Lindsey Graham","'People come here to have babies. They come here to drop a child. It's called 'drop and leave.'","Fact-checking the claims about 'anchor babies' and whether illegal immigrants 'drop and leave'","Legal Issues",2010-07-28
"http://data.gesis.org/claimskg/creative_work/80c44c6f-a8a5-51e4-b445-950802a89405","http://www.politifact.com/truth-o-meter/statements/2016/sep/18/tim-kaine/tim-kaine-says-millennials-agree-clinton-not-trump/","Tim Kaine","Says Hillary Clinton and millennials have the same positions on climate change, abortion rights, immigration reform, gay rights and college affordability. 'Donald Trump doesn't.'","Tim Kaine says millennials agree with Clinton, not Trump, on big issues","Climate Change,Gays and Lesbians,Abortion",2016-09-18
"http://data.gesis.org/claimskg/creative_work/17213330-4524-59c9-b08e-1b1dfa5e9907","http://www.politifact.com/punditfact/statements/2017/jun/21/ann-coulter/ann-coulter-says-trump-granted-amnesty-nearly-1000/","Ann Coulter","The Trump administration has granted amnesty to 'nearly 100,000 'Dreamers' '","Ann Coulter says Trump granted amnesty to nearly 100,000 'Dreamers.' Is that true?","Homeland Security",2017-06-08
"http://data.gesis.org/claimskg/creative_work/d29b87dc-a965-5172-b6ca-c5ebd24f659a","http://www.politifact.com/florida/statements/2011/oct/21/marco-rubio/sen-marco-rubio-said-his-parents-came-america-foll/","Marco Rubio","Says his parents 'came to America following Fidel Castro's takeover' of Cuba.","Sen. Marco Rubio said his parents 'came to America following Fidel Castro's takeover' of Cuba","Candidate Biography",2011-10-21
