"claim","review_url","claimer","text","headline","keywords","claim_date"
"http://data.gesis.org/claimskg/creative_work/57a5a3c9-bc7b-5ffa-9e35-2e6c8c75ed84","http://www.politifact.com/punditfact/statements/2014/jul/18/bill-oreilly/oreilly-says-over-half-immigrants-3-central-americ/","Bill O'Reilly","'More than 50 percent of immigrants from (El Salvador, Guatemala and Honduras) use at least one major welfare program once they get here.'","O'Reilly says over half of immigrants from 3 Central American countries use welfare","Welfare",2014-07-08
"http://data.gesis.org/claimskg/creative_work/fc2260e5-5856-5958-bbed-9c115f0cb7bb","http://www.politifact.com/facebook-fact-checks/statements/2019/mar/05/viral-image/meme-wrong-about-somali-americans-ilhan-omars-dist/","Viral image","'Obama settled 43,000 Somalian refugees in Minnesota. As of 2016, there were around 80,000. No wonder Ilhan Omar was elected. It was planned.'","Meme wrong about Somali-Americans in Ilhan Omar's district","Elections",2019-02-28
"http://data.gesis.org/claimskg/creative_work/24fbbc37-5d7f-5064-9a06-977c6cbd8cc0","http://www.politifact.com/truth-o-meter/statements/2010/sep/09/susana-martinez/richardson-denish-administration-gave-50000-driver/","Susana Martinez","The Richardson-Denish administration 'gave' 50,000 driver's licenses to illegal immigrants in New Mexico.","Republican candidate says opponent Denish put 50,000 illegal immigrants behind wheels","Message Machine 2010",2010-08-31
"http://data.gesis.org/claimskg/creative_work/9f78b835-0f4a-58c3-baeb-a81c22fe9167","http://www.politifact.com/wisconsin/statements/2016/aug/18/donald-trump/hillary-clinton-want-millions-illegal-immigrants-t/","Donald Trump","Says Hillary Clinton is 'proposing to print instant work permits for millions of illegal immigrants to come in and take everybody's jobs, including low-income African-Americans.'","Donald Trump off in saying Hillary Clinton wants illegal immigrants to take U.S. jobs","Technology",2016-08-16
"http://data.gesis.org/claimskg/creative_work/7cb547be-5830-5c01-b86f-70b8b632c4ab","http://www.politifact.com/florida/statements/2012/feb/14/glee/ricky-martins-character-tv-show-glee-says-us-censu/","Glee","'The U.S. Census believes that by 2030 the majority of Americans will use Spanish as their first language.'","'Glee' says the Census Bureau projects the majority of Americans will use Spanish by 2030","Census,Pop Culture",2012-02-07
"http://data.gesis.org/claimskg/creative_work/89e2a6e8-2aa0-5e3b-af3d-2f1a0a67c2ed","http://www.politifact.com/missouri/statements/2017/apr/24/claire-mccaskill/mccaskill-doesnt-account-all-refugee-cases/","Claire McCaskill","'Nobody applies to the United States for refugee status. They apply to the United Nations.'","McCaskill doesn't account for all refugee cases","Foreign Policy",2017-01-31
"http://data.gesis.org/claimskg/creative_work/eaae2b07-4c4c-5a8a-8dfd-fb829a626721","http://www.politifact.com/truth-o-meter/statements/2010/may/04/kyrsten-sinema/under-arizona-immigration-law-overgrown-lawns-bark/","Kyrsten Sinema","Under the Arizona immigration law, police are required to check immigration status if someone's 'lawn is overgrown' or if a dog is 'barking too loudly.'","Under Arizona immigration law, overgrown lawns, barking dogs could trigger questioning, lawmaker says","Legal Issues",2010-04-30
"http://data.gesis.org/claimskg/creative_work/49f7fc54-c1f3-568d-ba13-1fac739ba13d","http://www.politifact.com/truth-o-meter/statements/2014/aug/14/joe-miller/granting-illegal-immigrants-amnesty-will-destroy-s/","Joe Miller","'If 20 million illegals vote, you can kiss the Second Amendment goodbye.'","Granting illegal immigrants amnesty will destroy second amendment, says Senate candidate Joe Miller","Guns,Message Machine 2014",2014-08-09
"http://data.gesis.org/claimskg/creative_work/2e905b25-53ea-53be-90e6-bbc796a5a765","http://www.politifact.com/truth-o-meter/statements/2014/aug/12/libre-initiative/conservative-group-says-hispanic-business-growth-t/","LIBRE Initiative","'The startup rate of Hispanic businesses is three times the national rate.'","Conservative group says Hispanic business growth is three times faster than the national average","Small Business",2014-08-10
"http://data.gesis.org/claimskg/creative_work/f54b9fd4-64ba-5b8f-a187-e9a3ffe91e53","http://www.politifact.com/georgia/statements/2011/jun/03/janet-napolitano/homeland-security-chief-says-more-contraband-being/","Janet Napolitano","'We have seized more currency, more drugs, more outbound arms in the past year than any year in our country’s history.'","Homeland Security chief says more contraband being seized","Guns,Crime,Marijuana",2011-05-07
"http://data.gesis.org/claimskg/creative_work/a8487cb6-e9f1-50cb-a7d4-2d2b5e1aef5f","http://www.politifact.com/rhode-island/statements/2012/mar/25/peter-palumbo/rhode-island-state-rep-peter-palumbo-says-all-poll/","Peter Palumbo","'Every poll you see, the overwhelming majority of people want [E-Verify].'","Rhode Island state Rep. Peter Palumbo says that all polls show that the vast majority of people support E-Verify.","Workers,Polls and Public Opinion",2012-03-20
"http://data.gesis.org/claimskg/creative_work/6fa67334-bf22-5275-a6ca-9232f88e0689","http://www.politifact.com/truth-o-meter/statements/2017/feb/02/donald-trump/trump-claims-obama-made-deal-take-thousands-illega/","Donald Trump","'The Obama Administration agreed to take thousands of illegal immigrants from Australia.'","Trump claims Obama made deal to take thousands of illegal immigrants from Australia","Homeland Security",2017-02-01
"http://data.gesis.org/claimskg/creative_work/6588fcd8-a4eb-532e-a9a2-e64f06f772bd","http://www.politifact.com/truth-o-meter/statements/2014/jul/10/henry-cuellar/rep-texas-says-immigrant-minors-countries-dont-bor/","Henry Cuellar","'If you're a Mexican, you get sent back. ... But if you're from a noncontiguous country like the Central American countries' then you can stay in the United States.","Texas congressman says immigrant minors from countries that don't border the U.S. can stay","Children,Human Rights",2014-07-06
"http://data.gesis.org/claimskg/creative_work/19abc733-4406-53b7-ae1d-350d64771f7b","http://www.politifact.com/punditfact/statements/2017/dec/13/nofakenews-online/no-undocumented-immigrants-were-not-caught-voting-/","nofakenews-online","'Update: van full of illegals caught voting at multiple Alabama polling locations.'","No, undocumented immigrants were not caught voting in Alabama Senate election","Elections,Fake news",2017-12-12
"http://data.gesis.org/claimskg/creative_work/75a5a7a6-d7c1-5348-ae78-e4d29283b2c1","http://www.politifact.com/texas/statements/2014/jun/18/rick-perry/rick-perry-correct-record-number-immigrants-not-me/","Rick Perry","A record number of immigrants not from Mexico are 'being apprehended at the border.'","Rick Perry correct that record number of immigrants not from Mexico are being apprehended at border","Crime",2014-06-17
"http://data.gesis.org/claimskg/creative_work/ca668fce-6ea7-5501-bda5-a592b2ca11f1","http://www.politifact.com/texas/statements/2015/aug/28/ted-cruz/ted-cruz-obama-administration-released-104000-crim/","Ted Cruz","'In the year 2013, the Obama administration released 104,000 criminal illegal aliens. They released 196 murderers – people with homicide convictions, who are here illegally.'","Ted Cruz: Obama administration released 104,000 'criminal illegal aliens' including 196 murderers","Crime,Criminal Justice",2015-08-21
"http://data.gesis.org/claimskg/creative_work/691e0021-2f94-5341-b206-617322367396","http://www.politifact.com/texas/statements/2014/feb/10/steve-stockman/john-cornyn-voted-against-leaderships-immigration-/","Steve Stockman","John Cornyn 'voted twice in 2013 to back Obama’s amnesty plan.'","John Cornyn voted against leadership's immigration plan at committee level and on Senate floor in 2013","Voting Record",2014-01-31
"http://data.gesis.org/claimskg/creative_work/0a5a2c35-c5b4-558a-b20a-185754342cdb","http://www.politifact.com/truth-o-meter/statements/2015/jul/09/donald-trump/donald-trump-says-mexican-government-forces-many-b/","Donald Trump","'The Mexican government forces many bad people into our country.'","Donald Trump says Mexican government 'forces many bad people into our country'","Foreign Policy",2015-07-08
"http://data.gesis.org/claimskg/creative_work/7f7d0f19-6969-5e61-9ad1-1eb0fd708778","http://www.politifact.com/facebook-fact-checks/statements/2018/dec/13/blog-posting/did-migrant-caravan-demand-united-states-50000-eac/","Bloggers","'Migrants DEMAND $50,000 each to go home, or else …'","Did the migrant caravan demand $50,000 for each member?","Homeland Security",2018-12-12
"http://data.gesis.org/claimskg/creative_work/9c52cd64-e57b-57b6-b457-5bbb71b0823b","http://www.politifact.com/texas/statements/2018/jan/10/julian-castro/julian-castro-daca-recipients-employed-school-mili/","Julián Castro","Says a 'recent analysis' showed that 91 percent of Deferred Action for Childhood Arrivals (DACA) recipients are employed, in school or serving in the military.","Julián Castro says nearly all DACA recipients employed, in school or serving in military","Jobs,Legal Issues",2017-10-29
"http://data.gesis.org/claimskg/creative_work/f0b6e54f-3e8e-5caf-a5e6-7532584bae2b","http://www.politifact.com/north-carolina/statements/2016/oct/12/pat-mccrory/mccrory-says-syrian-refugees-not-properly-vetted-o/","Pat McCrory","Says Syrian refugees are not being vetted, and 'the FBI is not even being told where they are.'","McCrory says Syrian refugees not properly vetted or tracked by the FBI once in the US","Debates,Foreign Policy,Public Safety,Terrorism",2016-10-11
"http://data.gesis.org/claimskg/creative_work/4dbbc9c0-f99c-5dc2-b567-9ae85343a2a0","http://www.politifact.com/rhode-island/statements/2010/jun/25/michael-j-gardiner/gardiner-says-langevin-opposed-us-mexican-border-f/","Michael J. Gardiner","U.S. Rep. Jim Langevin didn't want a border fence to block illegal immigration 'because he is afraid that someone will get hurt trying to go around the fence.'","Gardiner says Langevin opposed U.S.-Mexican border fence for fear someone will get hurt","Homeland Security,Human Rights",2010-06-22
"http://data.gesis.org/claimskg/creative_work/8d304057-da8d-5612-9775-0ce4c0ad48e3","http://www.politifact.com/georgia/statements/2011/jul/01/robert-brown/lawmaker-compares-immigration-law-black-codes/","Robert Brown","Georgia’s illegal immigration crackdown laws should be called the 'Brown Codes' because of their similarity to the 'Black Codes' governing blacks after the Civil War.","Lawmaker compares immigration law to Black Codes","History",2011-06-02
"http://data.gesis.org/claimskg/creative_work/9a02adfa-5ab3-5af3-9e2c-af3ba17b5c61","http://www.politifact.com/truth-o-meter/statements/2017/nov/17/marsha-blackburn/rep-blackburn-claims-phoenix-murder-rate-decline-l/","Marsha Blackburn","'When Phoenix dropped its sanctuary city policy in 2008, its murder rate fell 27 percent the following year.'","Rep. Blackburn claims Phoenix murder rate decline linked to sanctuary city policy drop","Homeland Security,Crime",2017-11-09
"http://data.gesis.org/claimskg/creative_work/77f9f563-fecb-5892-b01c-19666b5dbce0","http://www.politifact.com/truth-o-meter/statements/2014/nov/21/ted-cruz/ted-cruz-says-2014-elections-voters-made-clear-the/","Ted Cruz","In the 2014 elections, 'the American people overwhelmingly said we don't want Obamacare … and we don't want amnesty.'","Ted Cruz says in 2014 elections, voters made clear their opposition to Obamacare, 'amnesty'","Polls and Public Opinion",2014-11-19
"http://data.gesis.org/claimskg/creative_work/5e093c35-7374-5a3b-9e80-5c03f311c62f","http://www.politifact.com/truth-o-meter/statements/2014/jul/10/jeff-flake/sen-jeff-flake-says-90-percent-immigrants-given-co/","Jeff Flake","When undocumented children are picked up at the border and 'told to appear later in court ... 90 percent do not then show up.'","Sen. Jeff Flake says 90 percent of immigrants given court dates fail to show up","Children,Foreign Policy,Legal Issues",2014-07-08
"http://data.gesis.org/claimskg/creative_work/81971ad8-d286-5c32-951c-dfcca7654b0c","http://www.politifact.com/florida/statements/2015/nov/20/rick-scott/do-federal-officials-plan-send-425-syrian-refugees/","Rick Scott","The federal government is 'making the decision, whether we like it or not, to send 425 refugees to our state' from Syria.","Do federal officials plan to send 425 Syrian refugees to Florida as Rick Scott says?","Terrorism",2015-11-17
"http://data.gesis.org/claimskg/creative_work/2d726965-134b-592b-93d8-7c01699282f4","http://www.politifact.com/illinois/statements/2016/jul/22/luis-gutierrez/do-all-strawberries-consumed-congress-pass-through/","Luis Gutierrez","'Every single strawberry that is served to Members of Congress will have passed through the rough hands of an undocumented immigrant.'","Do all strawberries consumed by Congress pass through hands of undocumented workers?","Agriculture,Jobs,Labor",2016-05-12
"http://data.gesis.org/claimskg/creative_work/72b344a1-0193-5b88-98fa-19b10da2c611","http://www.politifact.com/truth-o-meter/statements/2016/feb/26/marco-rubio/marco-rubio-says-donald-trump-had-pay-1-million-hi/","Marco Rubio","Says Donald Trump hired illegal workers 'from Poland and he had to pay a million dollars or so in a judgment.'","We Googled 'Trump Polish workers.' Here's what we found","Candidate Biography",2016-02-25
"http://data.gesis.org/claimskg/creative_work/28bbb059-0c2a-5beb-80f6-e028ee18bb13","http://www.politifact.com/wisconsin/statements/2018/jun/22/tammy-baldwin/trumps-executive-order-doesnt-address-2000-separat/","Tammy Baldwin","Says Donald Trump's executive order 'doesn't address the over 2,000 children who are already separated from their parents, and it doesn't change the fact that we would be jailing children with their families.'","Trump's executive order doesn't address 2,000 separated children and families would still be jailed?","Children,Families,Criminal Justice,Legal Issues",2018-06-21
"http://data.gesis.org/claimskg/creative_work/0abbcc46-0298-5946-8c12-31bbb2fbcd7c","http://www.politifact.com/truth-o-meter/statements/2017/nov/06/david-perdue/gop-sen-david-perdue-says-diversity-visa-lottery-p/","David Perdue","The diversity visa lottery is 'plagued by fraud.'","GOP Sen. David Perdue says diversity visa lottery 'plagued by fraud'","Homeland Security",2017-11-01
"http://data.gesis.org/claimskg/creative_work/006dfb7a-0f7a-58a5-b718-c5289e1ec24b","http://www.politifact.com/texas/statements/2011/oct/07/ruben-navarrette-jr/pundit-says-50000-hispanic-citizens-turn-18-and-be/","Ruben Navarrette Jr.","'Every month, another 50,000 U.S.-born Hispanics turn 18 and become eligible to vote.'","Pundit says 50,000 Hispanic citizens turn 18 and become eligible to vote every month","Elections",2011-09-28
"http://data.gesis.org/claimskg/creative_work/c36fc505-3453-53e2-b2ef-eb6f41054a8a","http://www.politifact.com/texas/statements/2013/feb/01/texas-federation-republican-women/republican-group-says-9-million-50-million-illegal/","Texas Federation of Republican Women","Says that 9 million to 50 million undocumented immigrants live in the United States.","Republican group says 9 million to 50 million illegal immigrants live in United States","Population",2013-01-17
"http://data.gesis.org/claimskg/creative_work/66286a9d-f293-57c2-9134-a8d3ca84af81","http://www.politifact.com/truth-o-meter/statements/2019/jun/07/tulsi-gabbard/tulsi-gabbard-right-citizenship-denials-are-higher/","Tulsi Gabbard","Says immigrant military service members applying for U.S. citizenship 'are getting rejected at higher numbers than those who are not veterans.'","Tulsi Gabbard is right: Citizenship denials are higher for military applicants compared to civilians","Veterans",2019-06-01
"http://data.gesis.org/claimskg/creative_work/87e17877-2fa5-57a2-a044-26b2219d367a","http://www.politifact.com/facebook-fact-checks/statements/2018/dec/13/blog-posting/website-falsely-claims-united-nations-caught-helpi/","Bloggers","'United Nations caught helping and coaching caravan illegal aliens!'","Website falsely claims United Nations 'caught helping and coaching' migrants","Homeland Security",2018-11-22
"http://data.gesis.org/claimskg/creative_work/7998166c-2633-54d0-90e5-fc85a8bb4056","http://www.politifact.com/wisconsin/statements/2019/mar/13/wisconsin-assembly-republicans/republicans-botch-claim-comparing-tuition-immigran/","Wisconsin Assembly Republicans","In-state tuition available 'for non-U.S. citizens after three years … veterans have to wait five years.'","Republicans botch claim comparing tuition for immigrants, veterans","Veterans,State Budget",2019-03-12
"http://data.gesis.org/claimskg/creative_work/9d6fb1c7-eb1e-5e70-bb23-67aeb54f24e8","http://www.politifact.com/rhode-island/statements/2011/jul/31/travis-rowley/young-republican-chairman-says-board-elections-hea/","Travis Rowley","'The RI Board of Elections has heard official testimony from Providence residents who claim to have witnessed known illegal aliens voting in local elections.'","Young Republican chairman says the Board of Elections heard eyewitness testimony from residents that illegal aliens voted in Rhode Island elections","Elections",2011-07-19
"http://data.gesis.org/claimskg/creative_work/180de113-166f-54a6-8aca-018a298e5122","http://www.politifact.com/truth-o-meter/statements/2017/jan/26/donald-trump/trump-claims-unanimous-endorsement-ice-border-patr/","Donald Trump","Says ICE and border patrol officers 'unanimously endorsed me for president.'","Donald Trump was not 'unanimously endorsed' by ICE, border patrol","Homeland Security",2017-01-25
"http://data.gesis.org/claimskg/creative_work/cc37852a-88d9-5491-a0d4-029f767d362d","http://www.politifact.com/georgia/statements/2015/mar/13/associated-press/true-legislation-would-open-scholarship-program-le/","The Associated Press","Under legislation that has cleared the Georgia House, some children who are 'legal refugees' could obtain state scholarships to attend private schools.","True: Legislation would open scholarship program to legal refugees","Autism,Children,State Finances,Families,Disability,State Budget",2015-03-09
"http://data.gesis.org/claimskg/creative_work/da59e58a-6674-52fb-9cc1-72e7db54368b","http://www.politifact.com/facebook-fact-checks/statements/2018/oct/23/blog-posting/hurricane-headed-toward-migrant-caravan-not-so/","Bloggers","'Intensifying Hurricane Willa headed directly toward 10,000 migrant caravan path.'","No, Hurricane Willa is not headed toward the migrant caravan","Environment",2018-10-22
"http://data.gesis.org/claimskg/creative_work/29c1881d-1505-5fc3-9a88-202625a6f98e","http://www.politifact.com/truth-o-meter/statements/2014/sep/17/trent-franks/isis-mexico-and-planning-cross-border/","Trent Franks","'It is true that we know that ISIS is present in Ciudad Juarez (Mexico)'","Is ISIS in Mexico and planning to cross the border?","Homeland Security,Iraq,Terrorism",2014-09-12
"http://data.gesis.org/claimskg/creative_work/d3febfcd-69f2-5079-af97-43f0556ed4d6","http://www.politifact.com/facebook-fact-checks/statements/2018/dec/19/blog-posting/no-evidence-claim-about-6-year-old-girl-found-us-m/","Bloggers","'Border agents discover body of 6-year-old girl: 'She was raped By 30 men'.'","No evidence for claim about a 6-year-old girl found at U.S.-Mexico border 'raped by 30 men'","Homeland Security,Fake news",2018-12-02
"http://data.gesis.org/claimskg/creative_work/a3d0f6c4-b0d8-582c-8ec6-e9faef2d3d4d","http://www.politifact.com/truth-o-meter/statements/2016/nov/28/javier-m-gonzales/santa-fe-mayor-defends-sanctuary-cities-says-studi/","Javier M. Gonzales","'Study after study have shown that sanctuary cities do not lead to an increase in crime because of the presence of people that are undocumented.'","Santa Fe mayor defends sanctuary cities, says studies don't show increase in crime","Homeland Security",2016-11-16
"http://data.gesis.org/claimskg/creative_work/467abc9e-956c-53c8-97d6-37337d028af8","http://factscan.ca/chris-alexander-paul-wells/","Chris Alexander","Chris Alexander: “Unbalanced [Paul Wells] manages to mention 1885 head tax, for which [Prime Minister Stephen Harper] apologized, w/o listing historic #Lib immigration misdeeds.” - FactsCanada","Chris Alexander: “Unbalanced [Paul Wells] manages to mention 1885 head tax, for which [Prime Minister Stephen Harper] apologized, w/o listing historic #Lib immigration misdeeds.” - FactsCanada","CPC,Chris Alexander",2015-06-12
"http://data.gesis.org/claimskg/creative_work/d74dd01d-6abf-549f-8415-abe35a413b78","http://www.politifact.com/truth-o-meter/statements/2018/apr/04/donald-trump/donald-trump-wrongly-claims-border-wall-under-cons/","Donald Trump","'We’ve started building the wall.'","Donald Trump wrongly claims border wall is under construction","Homeland Security",2018-04-03
"http://data.gesis.org/claimskg/creative_work/cfb65617-f50f-50b6-ab53-cb4f9d0c13f2","http://www.politifact.com/california/statements/2019/feb/28/kamala-harris/kamala-harris-tries-rewrite-history-false-claim-sa/","Kamala Harris","Says handing over arrested undocumented youth to ICE 'was an unintended consequence' of a 2008 San Francisco policy that she supported.","Kamala Harris tries to ‘rewrite history’ with False claim on San Francisco ICE policy","Crime,Public Safety",2019-02-24
"http://data.gesis.org/claimskg/creative_work/8cc0cdf3-8c5f-5edb-aaf1-a980dd6eb0a3","http://www.politifact.com/texas/statements/2016/may/26/pete-gallego/did-will-hurd-vote-border-security-bill-would-cut-/","Pete Gallego","Says Will Hurd 'cosponsored a bill that would militarize our border and allow 200 miles of new roads to be built in the Big Bend region -- cutting up our beloved park.'","Did Will Hurd vote for a border security bill that would cut up Big Bend National Park?","Elections,Drugs,Congress,Corrections and Updates",2016-04-22
"http://data.gesis.org/claimskg/creative_work/11ded477-0896-55e2-9894-8d0b57c381cf","http://www.politifact.com/georgia/statements/2015/mar/06/doug-collins/collins/","Doug Collins","President Obama said '22 times' he could not authorize immigration reform by executive order.","Collins largely on target","Congress",2015-03-03
"http://data.gesis.org/claimskg/creative_work/2127e1e0-62df-53fd-ac7f-aaae79d498af","http://www.politifact.com/facebook-fact-checks/statements/2019/jan/15/blog-posting/no-trump-family-did-not-donate-1-billion-border-wa/","Bloggers","'BREAKING: Trump family donates $1 billion to wall fund.'","No, Trump family did not donate $1 billion to border wall fund","Homeland Security,Fake news",2019-01-13
"http://data.gesis.org/claimskg/creative_work/2ff9bc8f-a30d-5de9-91c9-fbaee8da3561","http://www.politifact.com/texas/statements/2011/apr/01/john-cornyn/sen-john-cornyn-says-us-arrested-people-nations-de/","John Cornyn","Says that during the first 19 months of the Obama administration, the U.S. detained people from nations designated as state sponsors of terrorism on the southwestern border.","Sen. John Cornyn says U.S. arrested people from nations designated as terrorism sponsors on border with Mexico in first 19 months of Obama administration","Terrorism",2011-03-09
"http://data.gesis.org/claimskg/creative_work/a94ecedb-7b29-551c-a7a5-2f19f7eff8bf","http://www.politifact.com/rhode-island/statements/2012/jan/10/thomas-sgouros-jr/columnist-thomas-sgouros-jr-says-federal-e-verify-/","Thomas Sgouros Jr.","'[If] you apply for a job, the chances are 1 in 7 that you are going to be denied that job unfairly if everybody is forced to use E-Verify.'","Columnist Thomas Sgouros Jr. says federal E-Verify system unfairly denies job to 1 in 7 applicants","Jobs,Labor",2011-12-30
"http://data.gesis.org/claimskg/creative_work/fff8599a-98e2-538e-ac45-ea4bd2594b23","http://www.politifact.com/truth-o-meter/statements/2018/nov/29/donald-trump/donald-trump-falsely-says-family-separations-were-/","Donald Trump","Says of immigrant family separations at the border, 'we had the exact same policy as the Obama administration.'","Donald Trump falsely says family separations were Obama policy","Homeland Security",2018-11-25
"http://data.gesis.org/claimskg/creative_work/c3ce6ec1-f06c-5a1d-9509-bcf51ebcccd1","http://factscan.ca/jason-kenney-mediterranean-migration/","Jason Kenney","Jason Kenney: 'This [Mediterranean] migration is not related to political problems in Libya.” - FactsCanada","Jason Kenney: """"This [Mediterranean] migration is not related to political problems in Libya.” - FactsCanada","Defence,CPC,Jason Kenney",2015-04-29
"http://data.gesis.org/claimskg/creative_work/8819329f-94e8-503a-a8c0-16ccaeaa580d","http://www.politifact.com/florida/statements/2015/mar/05/david-jolly/federal-judge-called-obama-immigration-action-unco/","David Jolly","A federal judge said President Barack Obama’s executive action on immigration is 'unconstitutional.'","Federal judge called Obama immigration action 'unconstitutional,' David Jolly says","Homeland Security",2015-02-26
"http://data.gesis.org/claimskg/creative_work/440d3ebb-dadb-55b8-aa4d-b5d542063a98","http://www.politifact.com/truth-o-meter/statements/2013/jul/23/michele-bachmann/michele-bachmann-says-barack-obama-can-use-executi/","Michele Bachmann","'The president … by executive order' could grant voting rights to illegal immigrants who are newly legalized under pending legislation.","Michele Bachmann says Barack Obama can use executive order to give voting rights to illegal immigrants legalized under Senate bill","Elections,Legal Issues",2013-07-14
