"claim","review_url","claimer","text","headline","keywords","claim_date"
"http://data.gesis.org/claimskg/creative_work/08d3a4f1-3d82-5471-b53b-f63ca6e1b76e","http://www.politifact.com/punditfact/statements/2017/mar/07/social-media/social-media-post-pending-gop-bills-largely-accura/","Social Media","'It's important to pay attention to the Russian spy drama, but let's not ignore the fact that the following (10) bills have been introduced' in the House.","Social media post on pending GOP bills is largely accurate","Environment,Workers,Foreign Policy,Abortion",2017-03-06
"http://data.gesis.org/claimskg/creative_work/847d6fcd-e7b4-5dd1-9f32-21a0399ca39a","http://www.politifact.com/florida/statements/2019/jul/23/donna-shalala/yes-children-homestead-facility-get-far-less-time-/","Donna Shalala","Says children at Homestead migrant facility 'get 30 minutes over a month to talk to family members. If they were in a prison — a federal prison — they would get 300 minutes.'","Yes, children at Homestead facility get far less time to call family than federal prisoners","Criminal Justice",2019-07-21
"http://data.gesis.org/claimskg/creative_work/0b7554d7-6239-5fdc-869f-f8ab9a9459c7","http://www.politifact.com/truth-o-meter/statements/2015/dec/07/chain-email/youtube-video-says-michigan-muslims-can-list-multi/","Chain email","A Muslim immigrant in Michigan can list his second, third or fourth wives as 'extended family' and qualify for welfare.","YouTube video says Michigan Muslims can list multiple wives as 'extended family' for welfare","Income,Welfare,Islam",2014-08-26
"http://data.gesis.org/claimskg/creative_work/2e8aaf5c-8826-5d4d-b111-0ec0502a5f60","http://www.politifact.com/wisconsin/statements/2017/apr/26/ron-kind/yes-experiencing-net-outflow-illegal-undocumented-/","Ron Kind","'We're experiencing a net outflow of illegal, undocumented workers from America back to Mexico.'","Yes, we are experiencing a net outflow of illegal, undocumented workers from America back to Mexico","Homeland Security",2017-02-16
"http://data.gesis.org/claimskg/creative_work/fd9b49cd-b212-5b08-abba-6aa5cf5527e2","http://www.politifact.com/texas/statements/2013/may/30/veronica-escobar/el-paso-leader-says-el-paso-safest-city-its-size-c/","Veronica Escobar","Says El Paso is the 'safest city of our size in the nation.'","El Paso leader says El Paso """"safest"""" city of its size in country","Crime,City Government",2013-05-22
"http://data.gesis.org/claimskg/creative_work/1c66a5d4-6e31-559d-b82a-dcafecc977f5","http://www.politifact.com/truth-o-meter/statements/2014/sep/25/bill-cassidy/bill-cassidy-says-mary-landrieu-put-illegal-immigr/","Bill Cassidy","Says Mary Landrieu voted to fund benefits for illegal immigrants ahead of veterans.","Bill Cassidy says Mary Landrieu 'put illegal immigrants ahead of veterans'","Federal Budget,Veterans,Message Machine 2014",2014-09-19
"http://data.gesis.org/claimskg/creative_work/f60568f2-0d33-5809-92ee-0e11f12fb945","http://www.politifact.com/truth-o-meter/statements/2017/mar/02/donald-trump/trump-misleads-claim-about-terrorism-convictions-9/","Donald Trump","'According to data provided by the Department of Justice, the vast majority of individuals convicted of terrorism and terrorism-related offenses since 9/11 came here from outside of our country.'","Trump misleads in claim about terrorism convictions since 9/11","Homeland Security,Terrorism",2017-02-28
"http://data.gesis.org/claimskg/creative_work/6d6de9bb-fc05-5953-8eb8-e199c5625a94","http://www.politifact.com/truth-o-meter/statements/2013/jun/27/ted-cruz/border-security-immigration-bill-designed-never/","Ted Cruz","The Senate immigration bill 'has immediate legalization ... and the border security is sometime in the future, and just like in 1986, it's designed never to come into being.'","Senate bill has immediate legalization but border security that's 'designed never to come into being,' says Cruz","Corrections and Updates",2013-06-24
"http://data.gesis.org/claimskg/creative_work/429b91d4-2552-510c-99de-8dcd85ba7b9f","http://www.politifact.com/truth-o-meter/statements/2015/nov/11/donald-trump/trump-eisenhower-deported-15-million-immigrants/","Donald Trump","Says President Dwight Eisenhower 'moved 1.5 million illegal immigrants out of this country.'","Trump: Eisenhower deported 1.5 million immigrants","History",2015-11-10
"http://data.gesis.org/claimskg/creative_work/556ae8ea-e336-5de3-858f-95253c9971b0","http://www.politifact.com/truth-o-meter/statements/2019/mar/01/henry-cuellar/fact-checking-texas-congressman-border-patrol-hiri/","Henry Cuellar","Says President Donald Trump 'put out a $297 million contract to a vendor to show him how to hire Border Patrol. So, the first payment they made was $14.8 million. You know how many Border Patrol they hired with $14.8 million? Two.'","Fact-checking Texas congressman on Border Patrol hiring under Trump administration contract","Homeland Security",2019-02-22
"http://data.gesis.org/claimskg/creative_work/182fe374-1e99-5ec4-a3d9-848cad9d39c7","http://www.politifact.com/truth-o-meter/statements/2017/sep/11/eric-schneiderman/has-daca-been-ruled-unconstitutional/","Eric Schneiderman","'No court has held (Deferred Action for Childhood Arrivals) unconstitutional.'","What have courts said about the constitutionality of DACA?","Homeland Security",2017-09-06
"http://data.gesis.org/claimskg/creative_work/b7be07b8-a589-545c-afc7-344efd0799ea","http://www.politifact.com/truth-o-meter/statements/2010/jul/07/al-hunt/bloombergs-al-hunt-says-crime-down-arizona/","Al Hunt","'Crime is down in Arizona.'","Bloomberg's Al Hunt says crime is down in Arizona","Crime,This Week - ABC News",2010-07-04
"http://data.gesis.org/claimskg/creative_work/056c03ba-e3d8-5289-a0d5-9a52a019730e","http://www.politifact.com/truth-o-meter/statements/2017/oct/11/donald-trump/donald-trump-omits-facts-claim-loopholes-minors-un/","Donald Trump","'Loopholes in current law prevent ‘Unaccompanied Alien Children’ (UACs) that arrive in the country illegally from being removed.'","Donald Trump omits facts in claim about loopholes, unaccompanied minors","Homeland Security",2017-10-08
"http://data.gesis.org/claimskg/creative_work/39837578-d1cd-55d4-9be7-597f8970c1c3","http://www.politifact.com/arizona/statements/2018/apr/03/kelli-ward/Is-GOP-congresswoman-McSally-a-border-hawk-flip-fl/","Kelli Ward","Says Rep. Martha McSally 'is a #FlipFlopBorderHawk.'","Is GOP congresswoman McSally a border hawk flip-flopper, as Kelli Ward claimed?","Homeland Security",2018-03-16
"http://data.gesis.org/claimskg/creative_work/e9d93ab4-9bfd-5f3b-92e2-7c2ff0987573","http://www.politifact.com/facebook-fact-checks/statements/2019/aug/26/facebook-posts/post-comparing-mass-shooting-deaths-homicides-undo/","Facebook posts","Says 194 people were killed in mass shootings in 2018 while undocumented immigrants killed 83,211 people.","Post comparing mass shooting deaths to homicides by undocumented immigrants way off","Crime",2019-08-15
"http://data.gesis.org/claimskg/creative_work/2ea69397-7713-53e1-a8b9-26d532b9a6d0","http://www.politifact.com/truth-o-meter/statements/2018/nov/01/donald-trump/donald-trumps-pants-fire-claim-democrats-let-cop-k/","Donald Trump","'Democrats let him (cop killer Luis Bracamontes) into our country,' and 'Democrats let him stay.'","Donald Trump's Pants on Fire claim that Democrats let a cop-killing immigrant into the country","Homeland Security,Corrections and Updates",2018-10-31
"http://data.gesis.org/claimskg/creative_work/2bd169c2-5776-5f9b-b39d-e17da486bc22","http://www.politifact.com/texas/statements/2010/dec/10/organizing-america/arm-democratic-national-committee-says-americans-o/","Organizing for America","'An overwhelming majority of Americans support passage of the DREAM Act, which would provide a path to citizenship for undocumented youth willing to work for a college degree or serve in our armed forces.'","Arm of Democratic National Committee says Americans """"overwhelmingly"""" support passage of DREAM Act","Families,Military",2010-12-06
"http://data.gesis.org/claimskg/creative_work/e4ad31fd-cb8e-55f5-9439-a94531eb65b1","http://www.politifact.com/texas/statements/2011/sep/28/rick-perry/rick-perry-says-only-four-texas-lawmakers-opposed-/","Rick Perry","Says only four Texas legislators voted against a law giving in-state tuition rates to certain illegal immigrants.","Rick Perry says only four Texas lawmakers opposed in-state tuition law for illegal immigrants","States",2011-09-28
"http://data.gesis.org/claimskg/creative_work/a50685e1-058f-5ade-a16d-6cc33576480e","http://www.politifact.com/truth-o-meter/statements/2019/mar/07/america-first/did-beto-orourke-and-kirsten-gillibrand-say-theyd-/","America First","Says Beto O’Rourke and Sen. Kirsten Gillibrand 'have both said they would tear down the wall if elected president.'","Did Beto O'Rourke and Kirsten Gillibrand say they'd tear down border wall if elected president?","Homeland Security",2019-03-01
"http://data.gesis.org/claimskg/creative_work/6ed2f7f6-1c76-5c1e-88cf-6f3777d8b6c7","http://www.politifact.com/texas/statements/2016/oct/07/pete-gallego/pete-gallego-mostly-wrong-will-hurd-absolutely-sup/","Pete Gallego","Says Will Hurd said a border-long U.S.-Mexico wall 'absolutely makes sense.'","Pete Gallego mostly wrong that Will Hurd 'absolutely' supports Trump's proposed border-long wall","Homeland Security",2016-10-04
"http://data.gesis.org/claimskg/creative_work/e06c8567-7761-5da8-938f-cc73c89a3554","http://www.politifact.com/new-hampshire/statements/2018/jul/27/chris-sununu/sununu-says-nabbing-drug-traffickers-border-patrol/","Chris Sununu","'Every time they’ve done those border patrols, they’ve taken out people who have trafficked drugs. That’s the federal government’s role. They’re doing their job.'","Sununu says nabbing drug traffickers at border patrol checkpoints is federal government's job","Homeland Security,Drugs",2018-06-26
"http://data.gesis.org/claimskg/creative_work/6aaf6140-7f8e-5ab9-802b-1040bf1a965e","http://www.politifact.com/virginia/statements/2016/apr/18/don-beyer/don-beyer-wrongly-says-us-population-would-be-shri/","Don Beyer","'But for immigrants, we would have a contracting population...'","Don Beyer wrongly says U.S. population would be shrinking without immigrants","Population",2016-04-12
"http://data.gesis.org/claimskg/creative_work/007b9cfa-853c-5d64-a9cc-eaef2f2f98b7","http://www.politifact.com/texas/statements/2010/dec/31/lamar-smith/us-rep-lamar-smith-says-border-death-toll-28000/","Lamar Smith","'In the last five years, 28,000 people have been killed along the U.S.-Mexico border.'","U.S. Rep. Lamar Smith says border death toll is 28,000","Homeland Security,Crime",2010-12-15
"http://data.gesis.org/claimskg/creative_work/7419c9f6-93d9-5033-b672-d3e75ee1ff72","http://www.politifact.com/facebook-fact-checks/statements/2019/mar/22/blog-posting/bad-math-iran-nuke-deal-dollars-wouldnt-cover-30-w/","Bloggers","'We could build 30 walls with the $150 billion Obama gave to Iran.'","Bad math. Iran nuke deal dollars wouldn't cover 30 walls with Mexico","Iran,Fake news",2019-03-21
"http://data.gesis.org/claimskg/creative_work/0caf9597-8d01-5601-8ff1-311630a043e2","http://www.politifact.com/truth-o-meter/statements/2016/sep/02/donald-trump/donald-trump-strays-key-facts-hillary-clinton-amne/","Donald Trump","Says 'Hillary Clinton has pledged amnesty in her first 100 days, and her plan will provide Obamacare, Social Security, and Medicare for illegal immigrants, breaking the federal budget.'","Donald Trump strays from key facts on Hillary Clinton 'amnesty,' social programs for immigrants","Children,Retirement,Homeland Security,Federal Budget,Families,Debt,Medicare,Jobs,Medicaid,History,Deficit,Social Security,Legal Issues",2016-08-31
"http://data.gesis.org/claimskg/creative_work/11b335d5-afd2-5a7b-adb9-f3db9973bf5a","http://www.politifact.com/west-virginia/statements/2019/apr/08/shelley-moore-capito/fact-checking-gop-talking-point-walls-and-border-a/","Shelley Moore Capito","'Beginning in the early 1990s, we built barriers in 4 sectors at our southern border. Since each was built, those sectors have seen massive drops in apprehensions of people crossing the border illegally,' including 90 percent to 95 percent decreases in the Tucson, Yuma, San Diego and El Paso sectors. ​","Fact-checking a GOP talking point on walls and border apprehensions","Homeland Security",2019-01-30
"http://data.gesis.org/claimskg/creative_work/b613b68a-2025-5bbf-8908-c37d48b77902","http://www.politifact.com/florida/statements/2012/feb/09/presente/most-hispanics-support-dream-act-marco-rubio-does-/","Presente.org","'91 percent of Latinos support the DREAM Act, which allows undocumented youth to attend college,' but Marco Rubio opposes it.","Most Hispanics support the DREAM Act, but Marco Rubio does not","Message Machine 2012",2012-01-27
"http://data.gesis.org/claimskg/creative_work/82f85cc3-0fab-5c9d-8d0c-9401668f1226","http://www.politifact.com/truth-o-meter/statements/2010/jan/21/chain-email/chain-e-mail-claims-house-health-care-bill-would-p/","Chain email","The House health care bill provides for 'free abortion services, and probably forced participation in abortions by members of the medical profession.'","Chain e-mail claims House health care bill would provide free abortion","Abortion",2009-08-28
"http://data.gesis.org/claimskg/creative_work/29d99ddd-5f88-5cb9-899f-2f42b36f26b5","http://www.politifact.com/truth-o-meter/statements/2016/dec/01/bill-de-blasio/new-york-city-mayor-says-president-cant-defund-san/","Bill de Blasio","On Donald Trump’s plan to cut federal funding to sanctuary cities, 'because of a decision by the Supreme Court, no president's in a position to cut off funding across the board. It has to be very specific to the matter at hand.'","New York City mayor says president can't defund sanctuary cities 'across the board'","Homeland Security,Federal Budget,County Budget,State Budget,City Budget",2016-11-18
"http://data.gesis.org/claimskg/creative_work/1e1669ca-46ec-5ad6-93c9-f5386510665f","http://www.politifact.com/truth-o-meter/statements/2017/aug/03/donald-trump/false-trumps-claim-about-illegal-immigration-under/","Donald Trump","'The border is down 78 percent. Under past administrations, the border didn’t go down -- it went up.'","False: Trump's claim about illegal immigration under past administrations","Homeland Security",2017-07-28
"http://data.gesis.org/claimskg/creative_work/c8a23ee1-c3dd-57bd-aa8f-b72cc380e0f3","http://www.politifact.com/wisconsin/statements/2018/nov/02/scott-walker/walker-scores-illegal-aliens-claim-against-evers/","Scott Walker","Says Tony Evers wants to give in-state tuition and drivers licenses to 'illegal aliens.'","Walker scores with 'illegal aliens' tuition and driver's licenses claim against Evers","Jobs,Legal Issues",2018-10-23
"http://data.gesis.org/claimskg/creative_work/ab386342-3d4d-5b38-b344-d9758c68b2c1","http://www.politifact.com/truth-o-meter/statements/2010/may/19/steve-poizner/california-gop-candidate-blames-obama-health-care-/","Steve Poizner","'Taxpayer-funded benefits to illegals' in California are 'a skyrocketing cost under Obamacare.'","California GOP candidate blames Obama health care bill for """"skyrocketing"""" health costs","Message Machine 2010,Elections,Federal Budget,Poverty,Candidate Biography",2010-04-10
"http://data.gesis.org/claimskg/creative_work/8e4e8493-cfca-5457-9dcc-1bf8ee52357c","http://www.politifact.com/facebook-fact-checks/statements/2019/jun/05/facebook-posts/kirsten-gillibrand-did-not-say-undocumented-immigr/","Facebook posts","Says presidential candidate Sen. Kirsten Gillibrand said, 'Social Security must (be) expanded to illegal immigration, it’s their right.'","Kirsten Gillibrand did not say undocumented immigrants should get Social Security benefits for free","Social Security",2019-05-31
"http://data.gesis.org/claimskg/creative_work/cda7e041-9ae3-5eff-8764-27033c429ecb","http://www.politifact.com/texas/statements/2014/jul/02/david-alameel/alameel-lived-la-colonia-community-it-wasnt-coloni/","David Alameel","Says he lived in a colonia while working as a farm worker.","David Alameel lived in La Colonia in California, but it wasn't a colonia","Poverty,Candidate Biography",2014-06-28
"http://data.gesis.org/claimskg/creative_work/0513a691-b1fa-5fd4-992d-2d2240fd9e86","http://www.politifact.com/rhode-island/statements/2012/apr/05/doreen-costa/rhode-island-state-rep-doreen-costa-says-rhode-isl/","Doreen Costa","'This is the only state in the country that bypassed the General Assembly to authorize [in-state tuition for undocumented immigrants].'","Rhode Island state Rep. Doreen Costa says that Rhode Island is the only state that approved in-state tuition for undocumented immigrants without passing a law.","States",2012-03-26
"http://data.gesis.org/claimskg/creative_work/199399f8-975f-5a54-8808-c1632158cd5c","http://www.politifact.com/texas/statements/2018/sep/07/ken-paxton/ken-paxton-draws-debunked-figures-says-illegals-co/","Ken Paxton","Says Texas has 'had over 600,000 crimes committed by illegals since 2011. Over 1,200 homicides.'","Ken Paxton draws on debunked figures, says 'illegals' committed 600,000 crimes in Texas since 2011","Crime",2018-08-26
"http://data.gesis.org/claimskg/creative_work/c3b05839-6cb5-56ee-a2a8-89588dbb4e98","http://www.politifact.com/truth-o-meter/statements/2013/aug/28/janet-napolitano/2010-dream-act-has-strong-bipartisan-support-said-/","Janet Napolitano","The 2010 DREAM Act failed despite 'strong bipartisan support.'","The 2010 DREAM Act had 'strong bipartisan support,' said Janet Napolitano","Bipartisanship",2013-08-27
"http://data.gesis.org/claimskg/creative_work/4d4f10ab-3aed-5f59-a7de-246d3a3c2012","http://www.politifact.com/wisconsin/statements/2016/nov/03/ron-johnson/ron-johnson-russ-feingold-social-security-votes-ra/","Ron Johnson","Says Russ Feingold 'voted to raise taxes on Social Security benefits for seniors, he even tried to give Social Security benefits to illegal immigrants.'","Did Russ Feingold Social Security votes raise taxes and try to give benefits to illegal immigrants?","Income,Federal Budget,Social Security",2016-10-10
"http://data.gesis.org/claimskg/creative_work/6aa4b7d4-f48d-53f8-b1dc-844bbbe20527","http://www.politifact.com/florida/statements/2015/jul/28/donald-trump/donald-trump-says-number-illegal-immigrants-30-mil/","Donald Trump","The number of illegal immigrants in the United States is '30 million, it could be 34 million.'","Donald Trump wrongly says the number of illegal immigrants is 30 million or higher","Census",2015-07-24
"http://data.gesis.org/claimskg/creative_work/4f9b74d2-04e4-5135-8117-58556cc3c0d2","http://www.politifact.com/california/statements/2017/feb/01/ted-lieu/odds-youll-be-killed-terror-attack-america-refugee/","Ted Lieu","'The chances of being killed by a refugee committing a terrorist act is 1 in 3.6 billion.'","MOSTLY TRUE: Odds of fatal terror attack in U.S. by a refugee? 3.6 billion to 1","Terrorism",2017-01-27
"http://data.gesis.org/claimskg/creative_work/09fb7ce5-bfc4-5b0f-ae95-2925e92361d0","http://www.politifact.com/texas/statements/2013/nov/20/city-austin/20-austinites-foreign-born-mostly-mexico-asian-nat/","City of Austin","'Nearly 20% of our residents' are born abroad.","20% of Austinites foreign-born, mostly from Mexico, Asian nations","Population,Families,City Government,Diversity",2013-11-08
"http://data.gesis.org/claimskg/creative_work/7a2a18da-d991-5a82-b43f-fe34580e4b49","http://www.politifact.com/truth-o-meter/statements/2010/jun/10/chain-email/chain-e-mail-says-three-presidents-deported-total-/","Chain email","Presidents Hoover, Truman and Eisenhower collectively ordered the deportation of at least 15 million illegal aliens.","Chain e-mail says three presidents deported a total of 15 million illegal immigrants","History,Legal Issues",2010-06-09
"http://data.gesis.org/claimskg/creative_work/0f976ff6-d3d3-591d-8a15-54a9c9c52ff0","http://www.politifact.com/rhode-island/statements/2013/aug/01/david-cicilline/us-rep-david-cicilline-says-passing-senate-approve/","David Cicilline","'The Congressional Budget Office, a nonpartisan office, did an analysis and said that passing comprehensive immigration reform will reduce the federal deficit by $200 billion over the next decade.'","Cicilline says passing Senate-approved immigration bill would save $200 billion over ten years","Children,Families,Congress,Debt,Workers,Deficit,Legal Issues",2013-07-21
"http://data.gesis.org/claimskg/creative_work/59c30cc6-c105-5531-8bce-7dd1be26c6aa","http://www.politifact.com/florida/statements/2016/jan/26/donald-trump/donald-trump-says-course-mexico-can-pay-wall-becau/","Donald Trump","'When they say Mexico can't pay for the wall, I say of course they can. We have a trade deficit with Mexico that's unbelievably big. ... It's billions and billions of dollars -- far more than what we're talking about for the wall.'","Donald Trump says of course Mexico can pay for wall -- because of the trade deficit","Trade,Corrections and Updates",2016-01-20
"http://data.gesis.org/claimskg/creative_work/e4086696-9ead-5976-b01f-da01fb486ca2","http://www.politifact.com/facebook-fact-checks/statements/2018/nov/08/viral-image/facebook-meme-misleads-about-benefits-immigrants-w/","Viral image","'If you cross the border illegally in the U.S., you get a drivers license, medical insurance, housing, career training, the right to vote.'","Facebook meme makes false claims about benefits to immigrants who cross border illegally","Fake news",2018-10-31
"http://data.gesis.org/claimskg/creative_work/ecc2a024-3b14-5d06-b390-f9b3ee9b0697","http://www.politifact.com/florida/statements/2011/may/03/john-thrasher/sen-john-thrasher-says-e-verify-couldve-prevented-/","John Thrasher","Says that had E-Verify been in place in Florida when 9/11 terrorists lived here, 'we might have saved the lives of 3,000 Americans.'","Sen. John Thrasher says E-Verify could've prevented 9/11 attacks","Terrorism",2011-05-03
"http://data.gesis.org/claimskg/creative_work/60020fec-1304-5c96-bd19-29de2e47c70a","http://www.politifact.com/texas/statements/2011/jan/28/greg-abbott/attorney-general-greg-abbott-says-bullets-have-cro/","Greg Abbott","There have been 'at least four incidents where bullets from Mexico have crossed the border.'","Attorney General Greg Abbott says bullets have crossed the border from Mexico at least four times","Crime,Public Safety",2011-01-14
"http://data.gesis.org/claimskg/creative_work/e7c2835d-13e9-53b6-9109-76dba3dfeb76","http://www.politifact.com/california/statements/2018/may/29/john-cox/did-travis-allen-oppose-driver-licenses-undocument/","John Cox","GOP candidate for California governor Travis Allen 'on the floor vote … refused to join Republicans opposing driver licenses for illegal aliens.'","Did Travis Allen oppose driver licenses for undocumented immigrants?","Elections,States,Public Safety,The 2018 California Governor's Race,Driver's licenses",2018-04-23
"http://data.gesis.org/claimskg/creative_work/923411a9-abbc-5748-93a9-4c52087d6e76","http://www.politifact.com/texas/statements/2010/jun/18/david-dewhurst/dewhurst-says-phoenix-has-more-kidnappings-any-oth/","David Dewhurst","'Phoenix, Arizona, I'm told, is now the No. 2 kidnapping capital in the world, right behind Mexico City.'","Dewhurst says Phoenix has more kidnappings than any other city in the world except for Mexico City","Crime",2010-06-11
"http://data.gesis.org/claimskg/creative_work/86447d96-6a56-5dab-b8d4-3aa00403e91f","http://www.politifact.com/arizona/statements/2018/sep/21/martha-mcsally/martha-mcsallys-claim-kyrsten-sinema-voted-cut-ice/","Martha McSally","Says U.S. Rep. Kyrsten Sinema 'voted to cut ICE.'","Martha McSally's exaggerates Kyrsten Sinema votes on ICE funding","Homeland Security",2018-09-16
"http://data.gesis.org/claimskg/creative_work/650098ad-58f6-5d2f-b3a0-6d71bbf72cf6","http://www.politifact.com/texas/statements/2011/nov/22/rick-perry/rick-perry-says-hes-sent-400-million-border-ranger/","Rick Perry","'I have sent over $400 million to the border of Mexico in the form of Texas Ranger recon teams.'","Rick Perry says he's sent more than $400 million to the border for Ranger recon teams","State Budget",2011-10-01
"http://data.gesis.org/claimskg/creative_work/5ab23eb4-4302-5d7e-85c4-7a13247001b0","http://www.politifact.com/facebook-fact-checks/statements/2018/nov/06/blog-posting/dated-photo-used-make-false-claim-about-migrants-d/","Bloggers","Says photo of man shows 'diseases coming across the border.'","Dated photo used to make false claim about migrants, disease","Fake news",2018-11-02
"http://data.gesis.org/claimskg/creative_work/ec7f5adc-c5a5-5215-84f4-bebe84a0e26a","http://www.politifact.com/punditfact/statements/2018/feb/01/usa-train-news/rep-paul-gosar-asks-police-arrest-illegal-immigran/","USA Trainnews","'Rep. Paul Gosar asks Capitol Police to arrest illegal immigrants attending State of the Union.'","Rep. Paul Gosar asks police to arrest illegal immigrants at State of the Union","Congress,Fake news",2018-01-30
"http://data.gesis.org/claimskg/creative_work/7219c9a5-f7e2-5b87-bf49-d8afe8043608","http://www.politifact.com/truth-o-meter/statements/2018/nov/15/eric-swalwell/how-many-troops-has-donald-trump-sent-us-border/","Eric Swalwell","'15,000 troops will not see their families for #Thanksgiving because of @realDonaldTrump’s Scaravan Stunt. Oh yeah, it’s also costing you 200 million dollars.'","How many troops has Donald Trump sent to the U.S. border so far?","Military",2018-11-12
